body,name,score,parent_id,id,link_id,subreddit_id
OH! Yeah I was paid a million by my company (over the years). That's a stupid way to write that.,t1_cuiympx,1,t1_cuiyb8w,cuiympx,t3_3ijwaf,t5_2r3bl
Not taking a musket to church in Massachusetts.,t1_cn8ii47,959,t3_2qpt1e,cn8ii47,t3_2qpt1e,t5_2qh1i
"Ever hear of this new fangled program called ""Medicare""? These guys are eligible, and the government runs it, so it must be AOK by you? Yes? And you ever hear of this guy called ""Obama""? Yeah, he wants to shut down all the coal mines, so OBVIOUSLY these companies can't pay anybody of they are not able to mine coal. Yes?",t1_c8imho1,-19,t1_c8ilm9f,c8imho1,t3_18w1va,t5_2cneq
You have to send ss#'s and medical records by fax because the message can't be hacked like an insecure email. Secure email is sometime too much of a pain in the ass.,t1_ca03iqp,1,t3_1egab3,ca03iqp,t3_1egab3,t5_2qh1i
Thought it said Jets T-shirt and didn't wonder why it was free.,t1_csilj0q,74,t3_3b3eqf,csilj0q,t3_3b3eqf,t5_2qi1v
I only did the mirror thing once when someone parked one millimeter from my car door in a garage. I had to wedge myself in through the passenger side and climb over the seat.,t1_csji8ak,2,t3_3b6ncp,csji8ak,t3_3b6ncp,t5_2qhr3
Looks like my pool heater.,,2,t3_3ja3o3,cuo8p0f,t3_3ja3o3,t5_2tteh
"Small claims is a joke. If they don't show up you still have to pay a constable $75 to serve them with a capias, and if they're in another state you're shit out of luck.

I just don't complete anything until they pay. The IRS and state DOR are great collection agents when their taxes don't get filed.",t1_cgn441d,1,t3_22gl4n,cgn441d,t3_22gl4n,t5_2s7tt
"People come to the US and don't realize how dangerous some areas are. This ain't Holland. We have guns, and they ain't registered.",t1_cpjvhos,1,t3_2zkn0p,cpjvhos,t3_2zkn0p,t5_2qh1i
Bullion,t1_cp5x1dx,1,t3_2y1pwj,cp5x1dx,t3_2y1pwj,t5_2qh1i
They won't let my bisexual group march. Wah.,t1_cp323ni,-2,t3_2xs17j,cp323ni,t3_2xs17j,t5_2qh3l
Sucks it too hard. The sucking the golf ball through a garden hose is not what I'm into.,t1_cfjebom,2,t3_1yc1lw,cfjebom,t3_1yc1lw,t5_2qh1i
Strike up the banjos.,t1_cg59x1y,1,t3_20mv20,cg59x1y,t3_20mv20,t5_2s7tt
Contempt 1963. Nothing good is available on Netflix.,t1_csnhxg3,1,t3_3bjhhc,csnhxg3,t3_3bjhhc,t5_2qh1i
If you donate to a not for profit it is illegal to not have your name made public.,t1_csntgyw,4,t3_3ble13,csntgyw,t3_3ble13,t5_2r2jt
When my kids were in school in my old town they were raising money for a playground. My kids just graduated college and grad school. They had my old town on TV and there were all these signs for raising money for the playground. Dafuck?,t1_cqsqfme,1,t3_349qhm,cqsqfme,t3_349qhm,t5_2s7tt
You wouldn't know an economic system if it sat in your lap and called you daddy.,t1_crt5yyg,0,t1_crt54ao,crt5yyg,t3_387phv,t5_2cneq
What is so altruistic about taking money out of hard working people's paychecks?,t1_cttx5j2,-3,t1_cttqjq9,cttx5j2,t3_3fzunx,t5_2cneq
Obama doesn't take questions. He just make some Hitlerian speech and leaves.,t1_cu6dkys,0,t1_cu4wp5l,cu6dkys,t3_3h23ld,t5_2qh1i
R/politics in only for communists who support Bernie Sanders. If you don't they ban you.,t1_culxke1,1,t3_3j1npv,culxke1,t3_3j1npv,t5_2qh63
Too much noise. Too little quiet (like no musical background at times please).,t1_cplbqhl,1,t3_2znbo9,cplbqhl,t3_2znbo9,t5_2qh3s
The fuse is going to blow with the AC on. I guarantee it.--George Zimmer.,t1_cgj0k6c,1,t3_222k89,cgj0k6c,t3_222k89,t5_2s7tt
I can't see you tonight. My husband's back from Afghanistan.,t1_cgi5ccg,13,t3_220a3x,cgi5ccg,t3_220a3x,t5_2qh1i
"This is hilarious. ""No, liberals don't care about self interest. They vote for restrictive zoning by mistake."" WTF? This ""newspaper"" is laughable.",t1_cthxo4e,18,t3_3errzg,cthxo4e,t3_3errzg,t5_2qh63
O.k. if you say so. LOL,t1_ct04h1t,0,t1_csyyzvd,ct04h1t,t3_3cshqh,t5_2cneq
My ancestor never fought but stood by to quell riots in Baltimore. In those days it was white people rioting.,t1_ct3azhz,1,t1_ct3aw05,ct3azhz,t3_3d932l,t5_2qh1i
Because everyone in the whole world is trying to sneak in here and steal our money by going on welfare.,t1_cnn2dbm,1,t3_2s5nxb,cnn2dbm,t3_2s5nxb,t5_2szyo
Two iron. Thought my arm was going to shatter when I hit the ball.,t1_cnpzaa7,2,t3_2sinjo,cnpzaa7,t3_2sinjo,t5_2qh1i
I dunno just fucking around because I'm bored to tears.,t1_cucj6jw,1,t1_cucj3rg,cucj6jw,t3_3hxzhf,t5_2s3lm
Zimbabwe: rushing headlong into the Eocene Era.,t1_c8wasbj,1,t3_1aby6q,c8wasbj,t3_1aby6q,t5_2qh13
He's a nutcase from Vermont who never had a real job? Vermont! There's more people in my county than that entire backward state.,,0,t3_3kzwsb,cv2fsin,t3_3kzwsb,t5_2qh1i
"The Longest Day: John Wayne , Richard Burton, Peter Lawford, Sean Connery, Robert Mitchum, Henry Fonda, Rod Steiger, Eddie Albert ,and a bunch of other stars some of whom fought in WWII. Only took $10,000 apiece. Couldn't afford to film it in color.",t1_cmyx952,1,t3_2pp7vs,cmyx952,t3_2pp7vs,t5_2qh1i
I got cited for plagiarism. It was my own writing. I am a good writer. I took it as a compliment. My parents weren't mad.,t1_cgn4whr,1,t3_22gtjn,cgn4whr,t3_22gtjn,t5_2qh1i
Death at some point.,t1_cfjj0li,1,t3_1ydcd3,cfjj0li,t3_1ydcd3,t5_2qh1i
"Just ""teenagers"" as the news describes ""them"".",t1_cgj0flo,1,t1_cgixlhu,cgj0flo,t3_222g9f,t5_2s7tt
I don't think he would be worth anything.,t1_ct30h66,0,t3_3d8ayi,ct30h66,t3_3d8ayi,t5_2s7yq
Emily Dickinson.,t1_ct451e6,1,t3_3dd4zv,ct451e6,t3_3dd4zv,t5_2qh1i
"That ATT Wireless changed my payment due date by moving it up 26 days, and I had to be on hold for eight minutes to tell them it was illegal and to change it back.",t1_cti4cjk,2,t3_3et4nh,cti4cjk,t3_3et4nh,t5_2qh1i
Yeehaw!,t1_ct395ja,2,t3_3d9hv2,ct395ja,t3_3d9hv2,t5_2sfg5
See Archibald Blair 1984 and Aldous Huxley Brave New World. Here we are folks!,t1_cg59ooh,2,t3_20mi7b,cg59ooh,t3_20mi7b,t5_2qh13
"If I can say your middle name you owe me $20. O.k. ""your middle name"" you owe me $20.",t1_cgn89bt,1,t1_cgn6ru7,cgn89bt,t3_22gl0d,t5_2qh33
f you cnt.,t1_cgqb2s3,-2,t3_22sdqv,cgqb2s3,t3_22sdqv,t5_2qh0u
I believe I should be able to sit on my fat ass all day and collect a government check. Vote for me!,t1_cspyjcw,-12,t3_3buv02,cspyjcw,t3_3buv02,t5_2cneq
"If you're going to fight to the death, then we were happy to oblige.",t1_ctlut7h,1,t3_3ezmtc,ctlut7h,t3_3ezmtc,t5_2qqjc
Those who don't pay taxes vote for Bernie.,,1,t3_3t3gk5,cx3hxdf,t3_3t3gk5,t5_2s7tt
Mine. The reception was a pay bar. The ac went out. There was no music because the music system broke. The wallpaper that was supposed to be changed was still yellow aluminum foil. I guess my in laws were broke ass.,t1_cot6tit,-9,t3_2wq1uk,cot6tit,t3_2wq1uk,t5_2qh1i
This country was bought and sold 450 years ago.,t1_cmyp5bt,1,t3_2plvm8,cmyp5bt,t3_2plvm8,t5_2qh1i
"We have illegal aliens, ghettos, and Appalachia. Wat you got?",t1_ca02sin,-6,t3_1egdzl,ca02sin,t3_1egdzl,t5_2cneq
"Well, of course no illegal aliens are from Mexico and there are no rapists and murderers among them. ",t1_csor1ca,-26,t3_3br7rk,csor1ca,t3_3br7rk,t5_2qh3l
LOL.,t1_ctlj7ll,0,t3_3f2brk,ctlj7ll,t3_3f2brk,t5_2cneq
"On the road to Mandalay,
Where the old Flotilla lay,
With our sick beneath the awnings when we went to Mandalay!
On the road to Mandalay,
Where the flyin' fishes play,
An' the dawn comes up like thunder outer China
'crost the Bay!",t1_ctludvb,1,t3_3f3fa9,ctludvb,t3_3f3fa9,t5_2qqjc
That was super cool!,t1_ct49p2b,2,t3_3de3mi,ct49p2b,t3_3de3mi,t5_2rx57
Nothing much left to destroy.,t1_cm2nt88,1,t3_2ma5z8,cm2nt88,t3_2ma5z8,t5_2cneq
Because you'd have to put them all on welfare.,t1_ck3di3c,1,t3_2etcvy,ck3di3c,t3_2etcvy,t5_2sokd
"I've had so many bad experiences with Indians that I won't take them on as clients anymore. This past week  had an an Indian ex client who was constantly emailing me about work I did 2 years ago (which he paid me six months late for on purpose) demanding I do more with the work I had already done for free like extra copies of documents and changing addresses, etc. Simultaneously I had a soon to be former Indian client arguing with me about why he doesn't yet have to pay me for work I did , yes, six months ago. I threatened to sue him so he sent me a picture of a check. I told him I don't think the bank would accept a picture. Finally received it, and I'm done with him.",t1_ckhik1y,33,t3_2gav24,ckhik1y,t3_2gav24,t5_2qh1i
I didn't know they had a kitchen at the playground.,t1_cftfhsb,-2,t3_1zfdqs,cftfhsb,t3_1zfdqs,t5_2qh33
Tons of wheat.,t1_cftd0yq,1,t3_1zfz24,cftd0yq,t3_1zfz24,t5_2sokd
Not unless they can obey the law .,t1_crby3f4,-9,t3_369da8,crby3f4,t3_369da8,t5_2qh5b
Works for me.,,3,t1_cuzahn5,cuzbn45,t3_3knszp,t5_2qh68
"Newburgh, New York?",t1_cnr286j,1,t3_2skycb,cnr286j,t3_2skycb,t5_2qt55
"Yeah, don't fuck with us. We're crazy.",t1_cawohet,1,t3_1ho4l5,cawohet,t3_1ho4l5,t5_2qh33
With all the corruption in the US this would cost one fourth of our annual GDP and be completed by 2314.,t1_cnguhz8,0,t3_2rjdca,cnguhz8,t3_2rjdca,t5_2qh1e
Raskolnikov in Crime and Punishment,t1_cmzubsp,2,t3_2psj2e,cmzubsp,t3_2psj2e,t5_2qh4i
"So you had to fly an extra 7,000 miles to NYC and back to SF?",t1_cluwidh,1,t1_cluwf37,cluwidh,t3_2lgsfo,t5_2qh1i
So that's an unbiased news article by crackie!,t1_cspyxxa,-4,t3_3buw41,cspyxxa,t3_3buw41,t5_2cneq
"You mean ""Global Warming Propaganda website"".",t1_ct30vgh,-40,t1_ct2y9wq,ct30vgh,t3_3d8zay,t5_2qh3l
HAHAHAHAHAHA! You don't even know where the fuck Iran is! Hint:it's one of the countries that is not shaded green. The shaded green countries are Arab countries.,t1_ct30e1g,1,t1_ct3032s,ct30e1g,t3_3d82vc,t5_2qh13
"LOL. No wonder his name's Wiener. Well, Wiener, hopefully someone is going to sue the shit out of you for obstruction of justice.",t1_ct5lsou,-18,t3_3diy6e,ct5lsou,t3_3diy6e,t5_2qh3u
Whatever you say Poindexter. You must be an Obama supporter or something.,t1_ct2yksw,0,t1_ct2y63r,ct2yksw,t3_3d82vc,t5_2qh13
"Some guy I know from Pakistan was complaining about our shitty weather. I asked him how the weather was in Pakistan. He made a motion of drawing a pistol, shooting it, then blowing smoke away from the barrel.",t1_ct5c42o,2,t1_ct58qhc,ct5c42o,t3_3dhkkp,t5_2qh1i
Is he going to have a Reichstag fire?,t1_cta1w1m,2,t3_3dxnr4,cta1w1m,t3_3dxnr4,t5_2zbq7
Chinese here. Wish we could vote.,,4,t3_3kntov,cuzdmub,t3_3kntov,t5_2qh1i
The federal funding is only temporary. After that the states are on the hook. That's why they are rejecting it. Look it up.,t1_cac0i27,6,t3_1fncf3,cac0i27,t3_1fncf3,t5_2cneq
In other news Hillary deleted a bunch of emails that should have been on a government server.,t1_csg837m,-7,t3_3au9sk,csg837m,t3_3au9sk,t5_2cneq
How many graduate level economics courses have you taken? I have taken four.,t1_crt7jah,0,t1_crt726l,crt7jah,t3_387phv,t5_2cneq
The best part would be if you were with your wife.,t1_cskifr3,1,t3_3b7rwc,cskifr3,t3_3b7rwc,t5_2s7tt
He would have been a great novelist with all the people he made up.,t1_cs9m77p,2,t3_3a529g,cs9m77p,t3_3a529g,t5_2qqjc
I had to be 14 before I could have a gun. A Remington .22 was my 14th birthday present. Not really a rule it was the minimum age you could get an F.I.D.,t1_cqvckwb,2,t3_34hywb,cqvckwb,t3_34hywb,t5_2qh1i
"There is a Greek vase in the Museum of Fine Arts in Boston depicting a woman getting fucked up the ass. The inscription reads ""Hold still!"".",t1_cngrie9,2,t1_cngnyyh,cngrie9,t3_2rj6pl,t5_2qh1i
"So why is this not ""free"" for me?",t1_cnjp102,4,t3_2rsr8r,cnjp102,t3_2rsr8r,t5_2qh3l
Mazatlan donkey bar?,,1,t3_3knxke,cuz9tbr,t3_3knxke,t5_2x2oy
Just GTFO!,,2,t3_3kk0yk,cuz17fh,t3_3kk0yk,t5_2qht0
Fuck the Syrians.,,-5,t3_3l5gb0,cv3u26c,t3_3l5gb0,t5_2t776
Couples.,,2,t1_cuvqme9,cuvr64i,t3_3k861a,t5_2qh1i
The Batman Rises or something,t1_c9r73ll,-1,t3_1dkd80,c9r73ll,t3_1dkd80,t5_2qh1i
I was born in America and am white. By Webster's dictionary I am a white native. What other country would I be a native of?,t1_c9zvqgw,9,t3_1efn8u,c9zvqgw,t3_1efn8u,t5_2qh33
Wonder if she's a hooker.,t1_cjoku9s,1,t3_2dcqyb,cjoku9s,t3_2dcqyb,t5_2qh1i
I already graduated.,t1_cp36atn,1,t1_cozqt9c,cp36atn,t3_2xbtae,t5_2qh1i
Playing tennis with my gf in college. She was wearing a tube top. She served. She was wearing a tube bottom.,t1_cn3imk8,5,t3_2q6dys,cn3imk8,t3_2q6dys,t5_2qh1i
"I believe we will eventually discover that this DID come from the White House, so what's the problem again?

",t1_cac0tty,-10,t3_1fn6r1,cac0tty,t3_1fn6r1,t5_2cneq
"I was referring to the WWII savages, not the present day Japanese people.",t1_csu4h40,-6,t1_csu2z8t,csu4h40,t3_3cajar,t5_2w844
Same thing happened in Cali.,t1_ctluhej,1,t3_3f5gvu,ctluhej,t3_3f5gvu,t5_2qqjc
umm who dey?,t1_cufbhyu,-5,t1_cufbgau,cufbhyu,t3_3ias75,t5_2ug83
Most rich people give more to the Dems than the Republicans.,t1_csexjkk,-23,t3_3appuf,csexjkk,t3_3appuf,t5_2r40j
In Mass. double edged knives.,t1_cfq3rht,1,t3_1z1sdi,cfq3rht,t3_1z1sdi,t5_2qh1i
Fuck you. Buy my carbon credits!,,-1,t3_3km48w,cuz9ye7,t3_3km48w,t5_2qh63
Ohio?,,1,t3_3m8agp,cvdp941,t3_3m8agp,t5_2qh33
At least Tomlin didn't try to trip Gronk last night. Would have broken his foot though.,,1,t3_3ki0n8,cuy61wy,t3_3ki0n8,t5_2rx57
What's the most confusing holiday in Harlem? Father's Day.,t1_ca5cl90,2,t3_1exqvz,ca5cl90,t3_1exqvz,t5_2qh1i
"I think we have other problems like the deficit, ISIS, illegals, etc.",t1_ct4ecrj,-33,t3_3ddxhd,ct4ecrj,t3_3ddxhd,t5_2qhh7
The Patriots will win the Super Bowl.,t1_ctlwv4p,1,t3_3f507u,ctlwv4p,t3_3f507u,t5_2qh1i
King of Hearts!,t1_ct2z396,2,t3_3d5hg8,ct2z396,t3_3d5hg8,t5_2qqjc
I had someone lambaste me for about 20 minutes in a management meeting about their program not being able to afford the work stations we specified. So they went and bought some $200 one at Best Buy. I told them they're going to waste money when they buy 3 or more computers in 3 years. I got written up and quit.,t1_cshcjne,24,t3_3az06m,cshcjne,t3_3az06m,t5_2tfln
Godfather V,t1_cs36xi8,1,t3_39fg0n,cs36xi8,t3_39fg0n,t5_2qh1i
We have too many federal programs benefiting only the bureaucracy. How about some cuts here?,t1_c8vkxtp,0,t3_1aa883,c8vkxtp,t3_1aa883,t5_2cneq
Like I said taxpayers paying for gay porn.,,1,t1_cya4al7,cya8nnp,t3_3y1sb2,t5_2qh3p
"Getting the hell out of here. I think they forgot they hired a consultant to ""do stuff"".",t1_cgnbdbx,1,t3_22j2s5,cgnbdbx,t3_22j2s5,t5_2qh1i
She needs to get over herself. Here today gone today.,t1_chqbo45,-2,t3_26dirq,chqbo45,t3_26dirq,t5_2r2jt
According to who?,t1_ct49wk1,1,t1_ct46r38,ct49wk1,t3_3ddcpw,t5_2cneq
Nothing new under the sun.,t1_ct448kf,1,t1_ct3qv07,ct448kf,t3_3d9dv7,t5_2yipe
"If the IRS asks for donors names, then you have to report them to the IRS. You do not have to publicly disclose them though.",t1_csoq5d6,3,t1_cso4izz,csoq5d6,t3_3ble13,t5_2r2jt
HAHA. Welcome to the real world Shakira. There ARE consequences to your despicable behavior. That being said if she were not black she probably would not be admitted to Yale.,,-4,t3_3s8ll6,cwvjqku,t3_3s8ll6,t5_2qhlm
If I saw people like that I'd GTFO. fuck the thunderstorm.,t1_cavvlru,1,t3_1hm052,cavvlru,t3_1hm052,t5_2qh0u
"Get used to hearing ""President Trump"" Poindexter.",,3,t3_3ujrqc,cxgbp2n,t3_3ujrqc,t5_2s7tt
"As JFK once said, ""Ich bin ein Berliner!"" (I am a doughnut!).",,-1,t3_3si7fz,cwy1ipr,t3_3si7fz,t5_2qh0u
"That you don't have to move away from the place you grew up. Yes, you do!",t1_c9zxkhj,1,t3_1efxxe,c9zxkhj,t3_1efxxe,t5_2qh1i
One atom bomb. O.k. it's war. Two atom bombs. A little over the top.,t1_c8f83zg,1,t1_c8eoe31,c8f83zg,t3_18go5l,t5_2qh1i
Aren't all churches tax exempt? Is Cali going to contradict federal law and charge taxes to churches? Sounds idiotic.,t1_c9cb2m8,-2,t3_1c13lo,c9cb2m8,t3_1c13lo,t5_2qh2p
Too bad we don't nuke anybody anymore.,t1_cfhoeo4,-6,t3_1y5kw6,cfhoeo4,t3_1y5kw6,t5_2qh13
Sorry I offended your religion.if you have proof bring it on.,t1_ctje23j,-16,t1_ctjdwbb,ctje23j,t3_3ewlpy,t5_2zbq7
Do you believe you obtained the role because you're so good looking?,t1_ct4r2pb,1,t3_3deloy,ct4r2pb,t3_3deloy,t5_2qzb6
So what country would you go to if you needed a face transplant? Inquiring minds want to know.,t1_ct4qjmi,1,t1_ct3fq7f,ct4qjmi,t3_3d932l,t5_2qh1i
umm ignorance and communism is bliss. RIP.,t1_ct3lh4j,1,t1_ct3eupo,ct3lh4j,t3_3d932l,t5_2qh1i
I dunno. ,t1_cucj2ig,1,t1_cucj0w7,cucj2ig,t3_3i1gfu,t5_2zsxq
They would probably recommend I shoot myself.,t1_cgo8wcb,1,t3_22lg1o,cgo8wcb,t3_22lg1o,t5_2s7tt
"Hillary Clinton on deaths of Americans: ""Who cares?""",t1_c9zzrij,-36,t3_1eg8dk,c9zzrij,t3_1eg8dk,t5_2cneq
I hope they have GEICO.,t1_cjoje3d,1,t3_2dc96s,cjoje3d,t3_2dc96s,t5_2qh0u
Toy boxers from the 1890's.,t1_cmywmju,1,t3_2poyye,cmywmju,t3_2poyye,t5_2qh1i
"If they tried to build this in the US, it would cost literally trillions of dollars because of the unions.",t1_cugfofd,0,t3_3ifw3v,cugfofd,t3_3ifw3v,t5_2qh0u
"Nobody can be worse than the ""presidents"" we have had since 1980. Republican or Democrat they are all paid off shills for Wall Street rip offs. The ruling class sees the country as an asset to be ripped off. The country was bought and sold 450 years ago. Trump owes nobody anything and is personally frightened about what will happen to this country more for his children and grandchildren than himself. Would you go through all the crap of running for president if you had ten billion dollars and were 70 years old? I wouldn't. But he has anonymously done a lot of stuff for people that he won't reveal , and I trust him totally. IMHO.",t1_cucjk1d,0,t1_cucjegl,cucjk1d,t3_3i1lnv,t5_2qn70
Good idea. Wish we would do that in the US.,t1_cugmfzm,5,t3_3ig54w,cugmfzm,t3_3ig54w,t5_2qh13
Sounds like Grandpa on the Simpsons.,t1_cg5bf30,1,t3_20ng76,cg5bf30,t3_20ng76,t5_2qqjc
"11,000 DOLLARS? WTF? Is your family stupid?",t1_cgic9h3,1,t1_cgib273,cgic9h3,t3_220trw,t5_2qh1i
Nice mini mansion though. On my street they'd run it over.,t1_cgicg4n,20,t1_cgia922,cgicg4n,t3_220trw,t5_2qh1i
"Since he'll end up making at least $500,000 a year I guess he could well afford them, and I think you forgot about scholarships like Obama got as a foreign exchange student from Kenya.",t1_chb4hgd,0,t1_cgj6x51,chb4hgd,t3_223x6g,t5_2s7tt
Gee they're pretty busy up there doing shit.,t1_cnxdkwt,1,t3_2t85gn,cnxdkwt,t3_2t85gn,t5_2qnts
Low cost dental/ Low cost surgery what would you expect? And a big sign advertising extractions that 's what they do.,t1_ctmo2jh,0,t3_3f6td7,ctmo2jh,t3_3f6td7,t5_2qh1e
No I don't know any of that you fucking moron.,t1_csv3a1t,0,t1_csuwzc6,csv3a1t,t3_3c8l5u,t5_2r2jt
O.k. ,t1_ct38jg2,-1,t1_ct38hjp,ct38jg2,t3_3d932l,t5_2qh1i
When we came over we did not expect the Indians to pay for our welfare checks.,t1_ciptbn1,1,t3_29wgnx,ciptbn1,t3_29wgnx,t5_2qh1e
Advice Mallard is so anal and probably does anal.,t1_cgw2z5w,1,t3_23c7jv,cgw2z5w,t3_23c7jv,t5_2s7tt
Not at all.,t1_cuioikl,1,t1_cuibygy,cuioikl,t3_3imqar,t5_2qh0u
My college roommate's grandfather watched him speak. He promptly decided he was a lunatic and got the fuck out of Germany.,t1_ctu9co7,1,t3_3g113g,ctu9co7,t3_3g113g,t5_2qh33
No shit. It's 130 degrees in Kiribati 365 days a year.,t1_cu1xj3c,1,t3_3gu880,cu1xj3c,t3_3gu880,t5_2qh13
Call various money managers I know.,t1_ca00d1i,1,t3_1eg5h7,ca00d1i,t3_1eg5h7,t5_2qh1i
I'll let you know when I have 7 million dollars.,t1_cqjsjex,1,t3_33cfx0,cqjsjex,t3_33cfx0,t5_2ske1
Trust her. She's not like the others.,,1,t3_3mgrz2,cveyt91,t3_3mgrz2,t5_2s7tt
Boston FTW!,,1,t3_3j8542,cun9ln5,t3_3j8542,t5_2qhad
"Jerry Brown is dumber than a box of rocks. Like how he's wasting taxpayer money on non government stuff. BTW California is the #1 worst run state in the nation.

http://247wallst.com/special-report/2013/11/21/the-best-and-worst-run-states-in-america-a-survey-of-all-50-2/6/",,1,t3_3kw8wr,cv1fjul,t3_3kw8wr,t5_2qh0u
Thanks Obie!,t1_c8waw6z,-3,t3_1acvdp,c8waw6z,t3_1acvdp,t5_2cneq
I don't think that happened in Massachusetts. If you weren't a patriot you had to get the hell out of Dodge.,t1_csotngf,3,t1_csomg5n,csotngf,t3_3bqt80,t5_2qqjc
It lights a 5 second fuse.,t1_csl3ft1,1,t1_cskx8fv,csl3ft1,t3_3bawym,t5_2qhsa
You're employee at will. You don't have to do anything.,t1_cjpghh2,1,t3_2dfuyg,cjpghh2,t3_2dfuyg,t5_2qstm
Star Wars. ,t1_chtere9,2,t3_26osnu,chtere9,t3_26osnu,t5_2qh1i
Like to see Obama in a battle. Like to see him runnin' like an ol' hare away from the fight.,t1_ckaexta,-1,t3_2fkwp0,ckaexta,t3_2fkwp0,t5_2qqjc
I wonder if all 12 viewers watched it.,t1_cspu5le,-3,t3_3btkz4,cspu5le,t3_3btkz4,t5_2zbq7
"Pretty much the ruling class wants us divided, so we don't turn against them.",t1_ct5c5e6,1,t1_ct58pkq,ct5c5e6,t3_3dhkkp,t5_2qh1i
No sunlight. They should take vitamin D.,t1_ctlhgsc,1,t3_3f1kjb,ctlhgsc,t3_3f1kjb,t5_2qh1q
you'd have to clean my dick enuff to suck it clean,t1_ce60jp5,-1,t3_1t8upo,ce60jp5,t3_1t8upo,t5_2qq5c
Probably SAS or some black op folks.,t1_cngsyn5,1,t3_2ri427,cngsyn5,t3_2ri427,t5_2qh13
We have to support all the illegal aliens on welfare.,t1_cnn1n2v,3,t3_2s4j54,cnn1n2v,t3_2s4j54,t5_2qh1i
In Massachusetts we put terrorists on welfare so we can pay for their bombs.,t1_cacnem2,0,t3_1fp4om,cacnem2,t3_1fp4om,t5_2s7tt
What I learned late is life is work or starve. No welfare unless you're elderly or disabled.,,3,t3_3m4k7n,cvcvhbz,t3_3m4k7n,t5_2qhdx
"""wide wide world of sports"" as in ""What in the wide wide world of sports is going on around here?""--Slim Pickens.",,1,t3_3lxpke,cvafbwu,t3_3lxpke,t5_2qh1i
"Obama created the sequester. He wants to raise taxes (again) without any spending cuts whatsoever. Even Democrats voted down his budget bills, so why are you blaming congress?",t1_c8pjz1m,2,t3_19mx6l,c8pjz1m,t3_19mx6l,t5_2cneq
It's a Finnish soldier. Soviet prisoners were not killed but treated very well.,,3,t3_3j6xmq,cun751l,t3_3j6xmq,t5_2skqi
I saw one plane crash with this. Everyone on the plane saw their ultimate demise on TV.,,1,t3_3mory8,cvgzz48,t3_3mory8,t5_2ti4h
I was told by an engineer that does work in China that they were all taught by the Japanese to use a step by step process and cannot think creatively and intuitively about engineering problems. ,t1_cn9mva7,0,t3_2qslea,cn9mva7,t3_2qslea,t5_2qqjc
The management consultants on House of Lies. We don't have that much fun...ever.,t1_cfjix2p,3,t3_1yd6v9,cfjix2p,t3_1yd6v9,t5_2qh1i
Most confusing holiday in Harlem...,t1_c9zx2tl,6,t3_1ef3zv,c9zx2tl,t3_1ef3zv,t5_2qh33
The Mongols made the Silk Road safe all the way across Asia. Previously one had to sail to China.,t1_c9r6uje,2,t1_c9qxhyr,c9r6uje,t3_1djlsp,t5_2qh1i
Shouldn't it be NSFW?,t1_cgk54tj,1,t3_226t2e,cgk54tj,t3_226t2e,t5_2sbq3
"What if I told you you must be on welfare because you can't spell ""corporate"",",t1_cggl8uh,-2,t3_21tsyr,cggl8uh,t3_21tsyr,t5_2s7tt
"The Nazis were pro Muslim, and had Muslim SS troops. They both hated the Jews.",t1_cmwvpwm,0,t3_2pew3h,cmwvpwm,t3_2pew3h,t5_2qh13
So is the hermanos mug full of meth?,t1_cgq60wc,1,t3_22spni,cgq60wc,t3_22spni,t5_2qh3s
"Anyone who can't get an ID shouldn't vote. They're either an illegal alien or too stupid to be able to buy alcohol, drive, or get on a plane.",t1_crmrlfx,-16,t3_37gl8x,crmrlfx,t3_37gl8x,t5_2cneq
"Our defense secretary is a fucking Harvard physics professor and Rhodes Scholar:
https://en.wikipedia.org/wiki/Ash_Carter

Dunno how being a Harvard professor makes him qualified.",,-7,t3_3ridge,cwoggrr,t3_3ridge,t5_2qh68
Oh? Describe the process.,,1,t1_cx3jf2x,cx3n3k3,t3_3t3l0y,t5_2qm21
What the fuck is the difference?,,-1,t1_cx3vsl1,cx3wsch,t3_3t62we,t5_2qh2t
"Actually Trump is the same race as most Muslims and Mexicans, so how can he be racist? It must be great to call someone names and sit back so high on your horse when you are a fucking idiot.",,-16,t3_3xcemq,cy3k25f,t3_3xcemq,t5_2qh9a
Thank you Ed Markey for taking bribes and making the US's internet the shittiest in the whole world.,,1,t3_3x1iqt,cy18s5i,t3_3x1iqt,t5_2qh16
White lives matter because we outnumber blacks and will kill them if they continue to commit crimes against us.,t1_ct9clfq,-18,t3_3dw27d,ct9clfq,t3_3dw27d,t5_2qh3v
"Murica? Oh, Russkyland.",t1_ct76trh,0,t3_3dlfb9,ct76trh,t3_3dlfb9,t5_2vi9f
Tell the gangbangers that.,t1_ct5q6m5,1,t3_3di3gl,ct5q6m5,t3_3di3gl,t5_2cneq
Nope. They have to follow th ACA.,t1_ct447ud,1,t1_ct3shbq,ct447ud,t3_3d932l,t5_2qh1i
The 5 th national black convention meets. The Spanish Inquisition ends.,t1_cfhn6d3,17,t3_1y5f2a,cfhn6d3,t3_1y5f2a,t5_2qh1i
Use TD bank. No problems.,t1_cmxqkra,1,t3_2pl108,cmxqkra,t3_2pl108,t5_2to41
"People that were 5'3"" were now 6'2"".",t1_chrsr2c,2,t3_26k0d4,chrsr2c,t3_26k0d4,t5_2qh1i
My great uncle got ambushed by Machine Gun Kelly when he was an FBI agent.,t1_cs3c7gq,1,t3_39g086,cs3c7gq,t3_39g086,t5_2qh1i
My math teacher in prep school was so bad that he had to have the captain of the football team teach his class when he got stuck.,t1_cnxdzyz,1,t3_2takw0,cnxdzyz,t3_2takw0,t5_2qh1i
They didn't cut the calligraphers making $200K a year. In fact they are still hiring thousands of employees. It's Obama's choice to cut the tours and make the 2.4% cut IN GROWTH look serious.,t1_c8vjtpg,3,t3_1aa69m,c8vjtpg,t3_1aa69m,t5_2cneq
When I was buying a car and the salesman asked if I had a trade. I told him I was an accountant.,t1_cmt3b23,1,t3_2p3g9y,cmt3b23,t3_2p3g9y,t5_2qh1i
"My ""career"".",t1_cmov9z1,1,t3_2on3zy,cmov9z1,t3_2on3zy,t5_2qh1i
When he picked me up in a car with no gas and asked for gas money after appearing four hours after I expected him to.,t1_cfjgqmr,2,t3_1yciaa,cfjgqmr,t3_1yciaa,t5_2qh1i
Very stressful country. Everyone works their ass off.,t1_cggolmm,1,t3_21tusz,cggolmm,t3_21tusz,t5_2qh33
