body,name,score,parent_id,id,link_id,subreddit_id
My mother being alive.,t1_coigzpp,1,t3_2vje22,coigzpp,t3_2vje22,t5_2qh1i
"Try the movie ""Old Joy"". Pretty good.",t1_cqc86nz,1,t1_cqc4jvv,cqc86nz,t3_32jwie,t5_2qh1i
"Fuck her. she named the kid a fucked up word and probably doesn't even know what country she's living in. Really, do we have to put up with these ignorant bitches who are making their living sucking the money out of our paychecks? I'm sick of this shit. Fed up to here.",t1_cq32yy7,2,t3_31ktjc,cq32yy7,t3_31ktjc,t5_2to41
No Congress do not confirm now. Pay no attention to the man behind the curtain.,t1_cqjz3zw,2,t3_33cgj6,cqjz3zw,t3_33cgj6,t5_2cneq
LOL,,2,t1_cumawbo,cumxnu6,t3_3j3v1b,t5_2qh1e
"The guy is ignorant. He mispronounces Ahmed's name as ""Achmed"". I happen to know many Muslims named Ahmed. Also he keeps talking about racism. Get a clue Poindexter most Muslims are white. Hitler even had a Muslim Waffen SS division. The way Obama ""handled"" that he says is so brilliant just makes Obama look like a fool. MIT and Harvard also look like fools. Four years from now after this is all forgotten there will be a news story about how Ahmed didn't get into MIT or Harvard.",,-1,t3_3m5jsc,cvd6a3o,t3_3m5jsc,t5_2qh1e
When you go to the beach on Christmas Eve.,,1,t3_3ku71v,cv1eik3,t3_3ku71v,t5_2qh8e
Wow. Why is everyone walking on eggshells these days?,t1_cnn2be3,-2,t3_2s7e1q,cnn2be3,t3_2s7e1q,t5_2to41
That I'm really smart but hold back because I'm lazy. Bingo! Leave me alone with your problems.,t1_cshcxnv,1,t3_3axvnw,cshcxnv,t3_3axvnw,t5_2qh1i
Da white people done made my stupid nigga daddy president.,,-4,t3_3v6xve,cxlwdp8,t3_3v6xve,t5_33x33
"He would have been a Muslim had Stephanopolous not reminded him he was a ""Christian"".",,2,t3_3vqj5v,cxqkki3,t3_3vqj5v,t5_2qh4r
It sure was a government owned company.,t1_cpz4qbd,1,t1_cpo8onc,cpz4qbd,t3_2yn165,t5_2qqjc
"Love the unbiased reporting saying he's a bigot and slandering murderers and rapists by calling them murderers and rapists. LOL.
Their story on the ""rape"" was also a high level masterpiece of investigative journalism. Can they just fucking die already?",t1_ct498xj,-5,t3_3ddcpw,ct498xj,t3_3ddcpw,t5_2cneq
10. Don't talk to me. I'm a Masshole.,t1_ctjb1k9,-5,t1_ctj5h9i,ctjb1k9,t3_3ew904,t5_2qh1i
Idk. I think it is a local issue and not a federal one. Unless they amend the Civil Rights Act of 1964 to include LGBT people it's just one more t to cross and i to dot for people who are busy enough already educating the sometimes non receptive youth of today. IMHO.,t1_ct4pao4,-5,t1_ct4lzzf,ct4pao4,t3_3ddxhd,t5_2qhh7
"My buddy was in the Air Force in Vietnam, and he had the same comments about McCain a few months ago . He said everyone regarded it as a disgrace to be captured under any circumstances and not heroic. Another Air Force guy I know got captured during the Tet Offensive by the VC at Ton Son Nut after he was shot. He said he was treated humanely and fed the same food as the VC. He finally managed to decapitate a guard and escape. Nobody knew he had served in Vietnam until he appeared in the PBS documentary ""Vietnam"" with his name tag clearly visible as he boarded a DC3.",t1_ct98ja5,-2,t3_3duwb5,ct98ja5,t3_3duwb5,t5_2cneq
"Yeah, the Iroquois Confederacy didn't exist until the 17th century, and it looks like the Pequots massacred the Wampanoags, the Narragansetts, the Nausets, the Pamets, and a few dozen other tribes.",t1_cttjoai,1,t1_ctthlfo,cttjoai,t3_3fyj8g,t5_2si92
We have no control over the criminal element except by denying them welfare.,t1_culs1vp,1,t1_culjvzg,culs1vp,t3_3ihrz9,t5_2tz1e
That's really stupid on many levels.,t1_ctudnm4,4,t3_3g1gyz,ctudnm4,t3_3g1gyz,t5_2qh2p
Nothing. American people are sheep. All they want is welfare.,t1_cfqb863,1,t3_1z2wsj,cfqb863,t3_1z2wsj,t5_2qh1i
"Buncha thieves, who should be hanged.",t1_ch39yqg,1,t3_242kcp,ch39yqg,t3_242kcp,t5_2s7tt
Show me the federal statute that says you cannot discriminate against gay people.,t1_csntitn,1,t1_csnryhc,csntitn,t3_3bmfff,t5_2s7tt
sick...in a bad way.,t1_cgqavae,1,t3_22rnpd,cgqavae,t3_22rnpd,t5_2qh0u
Jayne Mansfield (Marisa Hartigays's mom) got her head chopped off in an auto accident.,t1_cltspwh,1,t3_2ldqgq,cltspwh,t3_2ldqgq,t5_2qh1i
Cape Cod League. You're welcome.,t1_cm2lur9,2,t1_cm2lkfy,cm2lur9,t3_2maeul,t5_2qh1i
I'm an American and I don't get it.,,1,t3_3tviz0,cxa64x3,t3_3tviz0,t5_2qh0u
It's about the Essex not Moby Dick you cretins.,,1,t3_3sgby3,cwxvtom,t3_3sgby3,t5_2qh3s
"I don't know anybody who was killed by an American with a registered firearm, but I DO KNOW a person that was killed by a ""REFUGEE"" that set off a bomb. Funny thing though this ""REFUGEE"" made trips back to his old country where he told US officials he was in fear of his life. His mother ""REFUGEE"" now lives there although she swore she was fleeing for her life but went back there when we gave her enough WELFARE to afford it.",,-1,t3_3tct58,cx5pbac,t3_3tct58,t5_2qh0u
Persecuted since 1667.,,10,t3_3semma,cwwq1os,t3_3semma,t5_2z166
You are one of my financial problems. Now GTFO.,,0,t3_3kpmeq,cuzzqsz,t3_3kpmeq,t5_2t5y3
"Per order of Der Fuhrer! Sieg Heil! We don't need no stinkin' courts! We don't need no stinkin' congress. I am the king, and what I say goes!",t1_ct2zjw9,-8,t3_3d7o5l,ct2zjw9,t3_3d7o5l,t5_2qh2p
Who are you the insult police?,t1_csu1lts,-5,t1_csu0imk,csu1lts,t3_3cajar,t5_2w844
I think if you do a minimum of research you will find out that there are numerous murderers and rapist among illegal aliens. One just killed a woman in San Francisco.,t1_csswvc5,0,t1_csqi2rq,csswvc5,t3_3bv8oa,t5_2qh3l
"Public officials have an obligation to speak with anyone with a press card given time constraints. If you are a private individual you don't have to speak with them, and from experience I recommend you NEVER speak to them, but I believe this guy has a LOT of time on his hands. Keep robotin' for the illegal aliens who shoot people. Go you!",t1_ct5vg1u,0,t1_ct5r78t,ct5vg1u,t3_3diy6e,t5_2qh3u
"Most muslims I know have a sense of humor, but I don't know any Egyptians.",t1_cswj4ou,1,t3_3ciaw9,cswj4ou,t3_3ciaw9,t5_2qh1e
The Roman roads were so bumpy that wagons had their wheels over the sides. To combat this the Romans had a large stone on the side of the road every few yards.,t1_ct3382l,2,t3_3d9dv7,ct3382l,t3_3d9dv7,t5_2yipe
"At this place I used to work the CEO went to great lengths to have a project where people would organize their folders. It was a huge project that took up hours of stupid meetings. I ""cleaned up"" a bunch of shit on the hard drive. Next thing I know everyone is howling at me that I deleted their work. Apparently NOBODY did fuck all to organize their files and completely ignored all the shit they were told to do at the useless meetings.",t1_cspzkr3,5,t3_3btntk,cspzkr3,t3_3btntk,t5_2sfg5
You're so full of shit I can't even begin...,,-1,t3_3pmi30,cw88omi,t3_3pmi30,t5_2sfmf
There were a few thousand more executed without trials Poindexter. Why don't you go down there and join your fellow travelers in chopping down sugar cane for nothing?,,-5,t1_cwg5m6b,cwg5s1g,t3_3qkiwz,t5_2qh0u
Sure if you want a 90% tax rate and the government to own your property.,,0,t3_3n5hla,cvltysi,t3_3n5hla,t5_2qh2t
They don't let foreigners drive. ,,1,t1_cvtqsd5,cvttfy0,t3_3o33bg,t5_2qh0u
In New Bedford they usually have a pic of dead gangbanger with RIP and a bunch of crosses on their back window.,,3,t3_3o39xb,cvtsd64,t3_3o39xb,t5_2qh33
This is so full of shit. When has this happened ever on the planet? ,,0,t3_3qe8m8,cwesl5x,t3_3qe8m8,t5_2qh13
"Good news! Pretty soon all you Finns are gonna be ""wealthy"". Congratulations!",,-3,t3_3kn6ve,cuzaash,t3_3kn6ve,t5_2qztz
Pagano and Hamilton should be gone. Let's see 1st and 10. Run up the middle. 2nd and 10. Throw to the sidelines or dump off to Gore. 3rd and long. Throw north/south to the incutting WR. Rinse repeat. Over and over again. I think the Jets finally got it.,,1,t3_3lwk28,cvak74z,t3_3lwk28,t5_2r6es
You can thank Senator Ed Markey for this.,t1_cfkd4x3,1,t3_1yfuy7,cfkd4x3,t3_1yfuy7,t5_2qh16
"There were only 5,000 people alive 65,000 years ago.",t1_coz29yj,51,t3_2xclak,coz29yj,t3_2xclak,t5_2qh1i
I was married. They were co workers. One was 12 years younger than I. One was 10 years older than I (her mother). One was a psycho.,t1_cp48cel,3,t3_2xwmsq,cp48cel,t3_2xwmsq,t5_2qh1i
Tesla already proposed this a hundred years ago.,t1_cpk1k5x,-2,t3_2zjajf,cpk1k5x,t3_2zjajf,t5_mouw
http://humanevents.com/2007/07/31/top-10-contributors-to-clinton-and-obama-presidential-campaigns/,t1_csf069x,-14,t1_cseyfg6,csf069x,t3_3appuf,t5_2r40j
Men don't buy those shitty books anyway.,t1_cs8q09t,1,t3_3a1061,cs8q09t,t3_3a1061,t5_2qhk3
ALL my male relatives of fighting age were drafted and went to war because of the Nazi's. Kinda sticks in your craw even 70 years later.,t1_ct36vou,0,t1_ct2vuy7,ct36vou,t3_3d932l,t5_2qh1i
"People who make the bench their little ""exercise station"" such as putting their drink, towel, etc. on it while they do shit near it. I asked a person doing this if I could use the bench for 5-10 minutes for (horrors) bench presses, etc. They said no. I complained to the staff. They did nothing. I quit the gym. Guess which one it was? It was the ""judgement"" free zone. Couldn't anyone tell them that they  also spelled ""judgment"" wrong about 100,000 times?",t1_ctr1q12,1,t3_3fndk4,ctr1q12,t3_3fndk4,t5_2qh1i
They probably only polled Democrats. It's an oft used gimmick.,t1_ctj5k0q,-5,t1_ctj4z61,ctj5k0q,t3_3ev73j,t5_2qh9a
I don't know anybody who had to shell out hundreds of thousands for healthcare do you? ,t1_ct5acge,1,t1_ct4qw7p,ct5acge,t3_3d932l,t5_2qh1i
Maybe in a big organization...,t1_ct4f6cx,1,t1_ct4ehst,ct4f6cx,t3_3ddy8a,t5_2s7tt
Omnia Gallia in tres partes divisa est.,t1_cr967hz,1,t3_35x977,cr967hz,t3_35x977,t5_2qh4i
Most gun deaths in the US are due to drug gang wars. Where I live we have about 3 shootings a night.,t1_cuhl4v5,3,t3_3ihrz9,cuhl4v5,t3_3ihrz9,t5_2tz1e
"James Woods was on flight 93 from Boston to LA in August, 2011. He reported to the FBI that there were a bunch of middle eastern people who sat through the whole flight silently observing. The FBI seemed to take him seriously since they showed up at his house at 7 in the morning. He asked how they found him. They said they were the FBI. Nothing came of it apparently",t1_cfpezek,10,t3_1z03ur,cfpezek,t3_1z03ur,t5_2qh3l
ISIS will cut your head off if you smoke.,,1,t1_cyldwnh,cynaelp,t3_3zax80,t5_2qqjc
Eiger Sanction?,t1_csnj6bu,1,t3_3bkh73,csnj6bu,t3_3bkh73,t5_2r8tu
"""If you're not white and went to Harvard, then you can make a living suing for discrimination when you suck at your job and steal people's money""--Deval Patrick.",t1_cs33o1k,1,t3_39dz7a,cs33o1k,t3_39dz7a,t5_38ktp
No.,,1,t1_cy1kqd4,cy28lqf,t3_3x2g99,t5_2qlqk
Yeah but the CAR that it's in won't last forever.,,1,t1_cygelo3,cygeo88,t3_3yrxyu,t5_2rete
"Not my experience with Muslims I know. They're pretty ""Americanized"".",,1,t3_3wifcy,cxwuxvn,t3_3wifcy,t5_2s7yq
Too bad they banned ddt.,,2,t3_3x0y95,cy0xkcl,t3_3x0y95,t5_2qqjc
How unfortunate.,,2,t3_3zbuo2,cylrsx7,t3_3zbuo2,t5_2yrq6
Illegal immigrants can't vote? But I'm sure that's coming.,t1_cue2sr0,0,t3_3i7me3,cue2sr0,t3_3i7me3,t5_2cneq
Nancy Kerrigan sat on my buddy's car. He did not appreciate it.,t1_cu9ms2e,1,t3_3hpfcs,cu9ms2e,t3_3hpfcs,t5_2qh1i
They're only worth 2 cents each because so many were made. There were so many made because Hitler was paid a commission on each stamp.,t1_cobapyw,1,t3_2urs76,cobapyw,t3_2urs76,t5_2ti4h
Oh. I really would be useless at that.,,1,t1_cw8yr5g,cw8yyey,t3_3povfm,t5_2s7tt
"That show sucks so bad. She just isn't funny, and I went to the same school as she did.",,-2,t3_3qgwg9,cwg58hw,t3_3qgwg9,t5_2qh33
There's no Santa.,t1_cphpydk,0,t3_2zbx3d,cphpydk,t3_2zbx3d,t5_2qh1i
(blanks) gotta (blank).,t1_cmcpzwh,2,t3_2nc9nz,cmcpzwh,t3_2nc9nz,t5_2qh1e
Some like porn movie eh?,t1_cuchdy3,0,t3_3i1gfu,cuchdy3,t3_3i1gfu,t5_2zsxq
"One guy, only guy in the restaurant AFTER closing time, did that and kept complaining his spaghetti was too cold. So we put his plate on the broiler and delivered it to him using a towel. Heard screams from the dining room. Job well done!",t1_cuf70qs,1,t1_cuf3tci,cuf70qs,t3_3i7k5j,t5_2qh33
Your logic is a little flawed. Bike lanes increase traffic. Hydrants don't increase fires.,t1_csat8kk,-23,t1_csap93o,csat8kk,t3_3aa49a,t5_2qi0s
Where do you live Mayberry RFD?,t1_cq332gy,1,t3_31jzcf,cq332gy,t3_31jzcf,t5_2to41
Looks like someone I work with. Wouldn't.,t1_cuci9fs,1,t3_3i1ltn,cuci9fs,t3_3i1ltn,t5_2r8lg
Yeah the Indians gave us EBT cards. LOL.,t1_cuc5x21,2,t3_3hwp46,cuc5x21,t3_3hwp46,t5_2cneq
They had a bunch of volunteers in NOLA. All WHITE.,t1_cum0ni5,2,t3_3j2e00,cum0ni5,t3_3j2e00,t5_2qqjc
"Yeah, that really means he's going to win too.",t1_cuhh86n,2,t3_3ijh1k,cuhh86n,t3_3ijh1k,t5_2zbq7
People collecting pensions at 40 years old.,t1_ct6kr5w,0,t3_3dkcow,ct6kr5w,t3_3dkcow,t5_2qh1i
All winnings are taxable. Only $600 or more are reported. Knew a guy who did 6 months in prison because he only reported stuff he made $600 or more on.,t1_ctlstz0,1,t1_ctldgdq,ctlstz0,t3_3f1so9,t5_2ti4h
The cops in my town ignore everything.,t1_ctlip89,1,t3_3f2hg0,ctlip89,t3_3f2hg0,t5_2yrq6
Can I also get free ice cream and gas? Thanks Santa!,t1_ct370ti,4,t3_3d8jg0,ct370ti,t3_3d8jg0,t5_2cneq
How old are you 12?,,1,t1_cy8go2f,cy8h03h,t3_3xujl9,t5_2qh63
"Must be boring being rich as fuck. He has this show called ""Cars, Comedians, and Coffee"" that nobody would put on television, so now it's on some shitty website. Gold, Jerry, gold!",t1_cuhtu3s,-3,t3_3imqar,cuhtu3s,t3_3imqar,t5_2qh0u
Next time have sex with someone you're in a relationship with?,t1_cuciw6z,-5,t3_3i1lo0,cuciw6z,t3_3i1lo0,t5_2qjdm
I'm sure  these firefighters aren't on the dole where is most taxes go.,t1_cudzhfo,0,t3_3i3xjj,cudzhfo,t3_3i3xjj,t5_2qh0u
No don't think he did.,t1_ctnz0vg,0,t3_3fcr1y,ctnz0vg,t3_3fcr1y,t5_2qh4r
DE,t1_ctr1j30,1,t1_ctqx0qc,ctr1j30,t3_3fncvu,t5_2rx57
"Man, I hate talking to people on the phone, Just text or email me please. And don't text or email ""call me"". It's such a waste of time especially when I am up against it.",t1_culsy2t,6,t3_3j15fb,culsy2t,t3_3j15fb,t5_2vegg
Xray vision --from one who saw a 270 pound 70 year old woman topless on a beach in Jamaica.,t1_cn4lnuh,1,t3_2qbbww,cn4lnuh,t3_2qbbww,t5_2qh1i
They were bathed when born and then bathed after they died. Perfume was big in them thar days/,t1_cfjhwjx,12,t1_cfjaton,cfjhwjx,t3_1ycopp,t5_2qqjc
Pan's Labyrinth.,t1_cgn3ssh,4,t3_22h3vp,cgn3ssh,t3_22h3vp,t5_2qh1i
But he doesn't take any questions except from plants.,t1_cu4ursz,1,t1_cu4qyhc,cu4ursz,t3_3h23ld,t5_2qh1i
hook me up mate.,t1_ctwbrzz,1,t3_3g9lyo,ctwbrzz,t3_3g9lyo,t5_2qh33
It is what it is.,t1_cucipfj,2,t3_3i1lqm,cucipfj,t3_3i1lqm,t5_2qh6p
Nobody could be worse than Obama.,t1_cserjnl,-32,t3_3aoxso,cserjnl,t3_3aoxso,t5_2t5y3
What about on Archer?,t1_cs0wink,1,t1_cs0tlmj,cs0wink,t3_395wpy,t5_2qh1i
I'm hungry.,,1,t3_3lyen7,cvahrfi,t3_3lyen7,t5_2r1v2
"Don't see Saudi Arabia taking 800,000 Syrians do you you Maricon?",,-4,t1_cushc68,cusi6bv,t3_3jugcv,t5_2qh13
A stupid kid smashed a ketchup packet with his fist on a table and showered my daughter with ketchup. I would have liked to file an assault charge against the stupid ape. (Not racist. He is white).,,-6,t3_3knp5t,cuzd5dp,t3_3knp5t,t5_2qh11
Lefty Ruggiero in Donnie Brasco.,t1_cn9bprb,1,t3_2qscvu,cn9bprb,t3_2qscvu,t5_2qh3s
Africa is a disaster.,t1_ctlhhkw,2,t3_3f4idn,ctlhhkw,t3_3f4idn,t5_2s7tt
"Apparently wearing a helmet decreases safety because drivers ,thinking you are experienced, take less care driving around you.",t1_cqvcyi7,1,t3_34i9ks,cqvcyi7,t3_34i9ks,t5_2qgzt
Why is she looking at me? Oh.,,1,t3_3pter6,cwa9fzr,t3_3pter6,t5_2qh1i
I don't think Trump is focused on Mexicans per se. Most illegals are from countries south of Mexico because our economy sucks so bad.,,-1,t3_3pocu8,cw8z28t,t3_3pocu8,t5_2qh4w
He was in the RAF and rescued 149 people. ,t1_cugjlpl,0,t3_3iepin,cugjlpl,t3_3iepin,t5_2wabq
You must be joking.,t1_ctz731h,1,t1_ctz5sam,ctz731h,t3_3ggtxw,t5_2qh1i
90 year old guys in wife beaters and basketball shorts walking chihuahuas.,t1_cguwb46,2,t3_239abq,cguwb46,t3_239abq,t5_2qh1i
Is that the cheap caviar or the expensive caviar?,,1,t3_3wij1b,cxwv5l9,t3_3wij1b,t5_2qh0u
I know Joe. That's what he does.,,1,t1_cxuro1k,cxuukd0,t3_3w7ui2,t5_2qh1i
"HAHAHAHAHA! The ""top earners"" are whoever they say they are. After a while they might be a married cop and a firefighter making $50K each. WOW! They earn six figures! Tax the fuck out of them! 
You'd be surprised how many tax deductions and credits ""phase out"" after you make only $75K in fact most of them.",,1,t1_cxvfk01,cxvfojj,t3_3wa76y,t5_2vhdb
Weird named for a small town in the middle of nowhere.,,2,t3_3vsssg,cxqfs0q,t3_3vsssg,t5_2u28p
I can say anything I want with no proof too. What a liar.,t1_cpvjxbm,-5,t3_30sd9q,cpvjxbm,t3_30sd9q,t5_2cneq
O.k. prove global warming without rigging the statistics.,t1_cprpakn,-8,t3_30ddfg,cprpakn,t3_30ddfg,t5_2cneq
"Jacket and sweater here in Boston. (Not Boston, England).",t1_csoxisx,1,t3_3bqhcb,csoxisx,t3_3bqhcb,t5_2qh33
But they paid for the research. BTW I worked for Pat Caddell in the 80's.,t1_ctj7bru,-1,t1_ctj6vra,ctj7bru,t3_3ev73j,t5_2qh9a
In Mass. you don't get no unemployment while it is contested. If you're illegal though you can get all the welfare you want.,t1_cgoak6j,-8,t1_cgo8ymx,cgoak6j,t3_22lxwk,t5_2s7tt
I don't think so if they were disabled because of the accident.,t1_cq80kqw,0,t1_cq7wi1p,cq80kqw,t3_32477r,t5_2cneq
"I was amazed you could chat with people from other countries for free. The first thing i did was insult a German guy in German. Yes, I'm an asshole.",t1_cpz5ght,1,t3_316oxn,cpz5ght,t3_316oxn,t5_2qh1i
You are sick.,t1_cfc6c5x,1,t3_1td1gt,cfc6c5x,t3_1td1gt,t5_2qq5c
Pass the tylenol.,,2,t1_cxb6f2x,cxbh7xb,t3_3u1fzo,t5_2s7tt
In Homeland the CIA gets blown up a lot.,t1_cuhh0yo,1,t1_cuhgtqo,cuhh0yo,t3_3ikq4k,t5_2szyo
I have no idea what this article was talking about at all. No statistical modeling no nothing.,t1_ctu53so,2,t3_3g0iy7,ctu53so,t3_3g0iy7,t5_2cneq
Whatever you say douche.,t1_ctu8x0a,-2,t3_3g0cot,ctu8x0a,t3_3g0cot,t5_2s7tt
"You don't see it in West Virginia, which is pretty poverty stricken. ",t1_cstuod2,23,t1_cstt9xr,cstuod2,t3_3capec,t5_2qh3l
Then they should be voted out of office.,t1_ct6hr6a,0,t1_ct5w3zc,ct6hr6a,t3_3diy6e,t5_2qh3u
"Y'all come back now y'hear? Just don't go to Massachusetts. People here are Massholes, if you know what I mean.",t1_ct3bau2,1,t3_3d4xae,ct3bau2,t3_3d4xae,t5_2u28p
Most of them were due last year.,t1_cgncbvj,-5,t3_22iz0b,cgncbvj,t3_22iz0b,t5_2s7tt
It's really just a big tax increase. Ask the Supreme Court. If it weren't a tax it would violate the commerce clause of the constitution.,t1_cggoxqv,3,t3_21t83f,cggoxqv,t3_21t83f,t5_2sokd
Doesn't matter. You Bernie loonies are sorely outnumbered.,,-3,t3_3x7lvo,cy2xdm9,t3_3x7lvo,t5_2r5tm
That I'll die in the next few decades.,,2,t3_3x4p81,cy28trx,t3_3x4p81,t5_2qh1i
That's from a contact lens commercial.,t1_cm68u03,0,t3_2mo9at,cm68u03,t3_2mo9at,t5_2to41
People that don't signal they're taking a right when you're taking a left and make you wait for them for nothing. Sometimes I chase them down and give them the finger.,t1_cqd7cme,1,t3_32ocqt,cqd7cme,t3_32ocqt,t5_2qh1i
"A not for profit with 2 hour management meetings where the overpaid (actually works 10 hours a week) ""CEO"" acts like Josef Stalin or Adolf Hitler.",t1_chz5of9,1,t3_27amxf,chz5of9,t3_27amxf,t5_2qh1i
Venice before crack.,t1_cqv5kpa,22,t3_34itlx,cqv5kpa,t3_34itlx,t5_2tycb
Most crashed pilots.,t1_cqv9wid,1,t3_34htf3,cqv9wid,t3_34htf3,t5_2szyo
Virgins?,,0,t3_3v7nxh,cxlnbgr,t3_3v7nxh,t5_2qh33
I Claudius,,1,t3_3yuf6l,cyhd6sh,t3_3yuf6l,t5_2qh1i
Wot?,,1,t1_cy8i7qu,cy8insw,t3_3xqxfl,t5_2qhu2
The hypocrisy from Davos just keeps coming and coming.,t1_cnwnvun,2,t3_2t60y5,cnwnvun,t3_2t60y5,t5_2qh3l
Because I pay taxes.,,0,t1_cwagbhs,cwc5vx7,t3_3pwg4c,t5_2s7tt
I started a business 9 years ago. When I have a don't give two shits attitude towards it I seem to get more customers. (?),t1_cgn82np,1,t3_22h6q1,cgn82np,t3_22h6q1,t5_2qh1i
"O.k. then maybe it has something to do with the ""culture"" of the welfare recipients we have.",,-4,t1_cwfv3yc,cwfz4w2,t3_3qeia7,t5_3328c
General Motors.,,0,t3_3nuaty,cvrntgt,t3_3nuaty,t5_2qh1i
Sidney Poitier. Awesome laid back really tall guy.,t1_coz2u9h,1,t3_2xbtae,coz2u9h,t3_2xbtae,t5_2qh1i
"The Dick Van Dyke Show where Rob is mistaken for a fancy dan writer named ""Petrov"". When he says to the host he writes for the Alan Brady Show she tells him she ""doesn't own a television machine"". ",t1_coru070,1,t3_2wjbtx,coru070,t3_2wjbtx,t5_2qh1i
Just not my type.,t1_cucirpm,1,t1_cucifbr,cucirpm,t3_3i1ltn,t5_2r8lg
"Oh, yeah, O.k. got it.",t1_cufd51b,-2,t1_cufcv0r,cufd51b,t3_3ias75,t5_2ug83
Depardieu's last film tried to make it look really cool.,t1_csjpjo4,1,t3_3b6y2o,csjpjo4,t3_3b6y2o,t5_2qh33
Not in the wilderness but in a woodsy town. My friend says he and his family heard a large party with a lot of people talking and laughing on night across the street from his house in the woods. In the morning he looked out and there was no house or anything just an old foundation with no houses near it.,t1_csjdh27,3,t3_3b4ifn,csjdh27,t3_3b4ifn,t5_2qh1i
Dewdrops on roses and whiskers on kittens.,t1_cp6bwy2,2,t3_2y4v8m,cp6bwy2,t3_2y4v8m,t5_2qh1i
"What's this ""cinema"" you are referring to?",t1_ciui9cx,1,t3_2af2t5,ciui9cx,t3_2af2t5,t5_2qh1i
The highways are paid for with the gasoline tax not the income tax. We're going to have 40 million people in the country to do manual labor.,t1_crmtrqo,1,t1_crmt21i,crmtrqo,t3_37fwwz,t5_2cneq
"I worked for an ambulance company, and the paramedics would use an IV of benadryl.",t1_coz2kav,1,t3_2xd0g9,coz2kav,t3_2xd0g9,t5_2qh1i
Then Hillary would be in prison.,t1_crnlhwn,1,t3_37hh9g,crnlhwn,t3_37hh9g,t5_2s7tt
"I would guess north of $500,000? Why should we pay for welfare cheats that aren't even from this country? We have enough native cheats as it is.",,-4,t1_cvl0e6a,cvl4u5i,t3_3n3hu5,t5_2qm21
I almost got fired for advertising my side business. I guess they didn't know it was illegal to do that.,t1_cltybwa,1,t3_2le5he,cltybwa,t3_2le5he,t5_2qh1i
Shouldn't have brought a knife to a gun fight.,t1_cgi5xk8,0,t3_21zmd7,cgi5xk8,t3_21zmd7,t5_2qh1e
Idjet.,t1_cgj0b73,2,t1_cgiyg8w,cgj0b73,t3_2227dq,t5_2qh0u
Goldman Sachs and JP Morgan are unions? Who knew?,t1_cseybaa,-14,t1_csexngq,cseybaa,t3_3appuf,t5_2r40j
Global warming is a giant hoax designed to make people like Al Gore rich.,t1_crubo18,1,t3_388s09,crubo18,t3_388s09,t5_2qh1i
Yawn.,t1_csjne67,5,t3_3b6utt,csjne67,t3_3b6utt,t5_2qlqk
Who are these good guy bosses? Everyone I've ever worked for was an asshole.,t1_cfji08m,1,t3_1yasnv,cfji08m,t3_1yasnv,t5_2s7tt
My dad told that to me when I was 3.,t1_cnxgcvi,0,t3_2t9lyk,cnxgcvi,t3_2t9lyk,t5_2qqjc
Gay people who want to march in St. Patrick's Day parades.,t1_cp6lzhw,1,t3_2y2m1m,cp6lzhw,t3_2y2m1m,t5_2qh1i
The movie sucks. Don't bother.,t1_cpk8mve,1,t1_cpk5dx5,cpk8mve,t3_2zk8q8,t5_2qh1i
"Hi, I am a moron who cannot add 2+2. In my opinion climate change is our fault. Now give me money for credits. No? Who are you to oppose me Adolf Hitler?",t1_cgln8m8,5,t3_22c5m8,cgln8m8,t3_22c5m8,t5_2qh13
People are still receiving Civil War soldiers' pensions.,,20,t3_3uudrc,cxi3w8g,t3_3uudrc,t5_2qh1i
I guess there aren't really any problems for him to focus on at the moment huh?,,1,t3_3t7mw4,cx4iate,t3_3t7mw4,t5_2qo4s
Currently Warren Buffet's railroad transports the oil. Obama is Buffet's butt boy. Ironically the price of oil is so low that this pipeline is becoming irrelevant.,t1_cngt3pf,-6,t3_2rjz7w,cngt3pf,t3_2rjz7w,t5_2qh3l
Told you what?,t1_cngqqqd,3,t1_cngqec4,cngqqqd,t3_2rj6pl,t5_2qh1i
Also meth.,,0,t1_cxlrulq,cxlu61h,t3_3v9m0y,t5_2qh1e
We have Masshealth in Mass. Medicaid is only for disabled people.,t1_coz3odd,1,t1_cnydhyl,coz3odd,t3_2tefne,t5_2qnts
"We used to have block parties in college, and the cops would always make us move the barricades. We gave them beer, and they overlooked the dope smoking.",,-17,t3_3q88ay,cwdbm1m,t3_3q88ay,t5_2ubgg
can I see a list rather than just a blanket statement that is probably a lie?,,-2,t1_cwfcdhu,cwfdpuy,t3_3qelsy,t5_2qh13
70% of the refugees are men. So Obama is a liar obviously.,,1,t1_cx9i50h,cxai50g,t3_3tuxy9,t5_2qh13
Ummm..collect bribes from lobbyists? Yeah that's the ticket.,,1,t3_3tan1z,cx593qc,t3_3tan1z,t5_2s7tt
No reservoirs. No water. Pretty simple. BTW really objective article too.,t1_cqneeh9,2,t3_33pbsl,cqneeh9,t3_33pbsl,t5_2cneq
Illegal to demote people for doing that in the U.S.,t1_cqeo0t1,5,t3_32teg6,cqeo0t1,t3_32teg6,t5_2qjvn
"Nope,nope,and nope.",t1_cpp8j5s,1,t3_304g58,cpp8j5s,t3_304g58,t5_2qh0u
Why are they concerned?,t1_cthu2lf,4,t3_3eonvc,cthu2lf,t3_3eonvc,t5_2s7yq
31 year old women.,t1_c8wb8ma,1,t3_1acuwp,c8wb8ma,t3_1acuwp,t5_2qh1i
So 5 kids and baby's daddy in jail. Probably black and on welfare?,t1_cc66pa4,-2,t3_1m5ar1,cc66pa4,t3_1m5ar1,t5_2qh61
Hitler's nephew was in the US Navy in WWII.,t1_cmt3slx,2,t3_2p1oxf,cmt3slx,t3_2p1oxf,t5_2qh1i
The stupid thing to do is more like it.,,-3,t3_3pwg4c,cwabuw6,t3_3pwg4c,t5_2s7tt
No in Qatar he is Einstein. They have masters degrees on how to use hammers and fuck goats for fun.,,-4,t1_cwgani1,cwgi0ry,t3_3qjads,t5_2tnz9
"I thought it said ""The Golden Cod"" then flash to a picture of the Massachusetts State House.",,1,t3_3pr9s4,cw8y6ak,t3_3pr9s4,t5_2s28b
My hairdresser said Hoxha made them evacuate to these bunkers every so often claiming that they were going to be invaded by the US.,,10,t3_3npgtl,cvq7vc6,t3_3npgtl,t5_2sh6t
