body,name,score,parent_id,id,link_id,subreddit_id
Da fuck? Of course they made a profit!,t1_ctn5jyw,-12,t1_ctn5aw2,ctn5jyw,t3_3fak77,t5_2cneq
Dat be rassist.,t1_ctfqexh,1,t3_3eiyx9,ctfqexh,t3_3eiyx9,t5_2qh1e
Alrighty then!,t1_csv8mcu,1,t3_3ccl4a,csv8mcu,t3_3ccl4a,t5_2qh1i
"The Tsarnaev family was on ""full boat"" welfare including free college tuition. I think it is relevant because there is a pattern here.",t1_csv7z03,3,t1_csv3wyu,csv7z03,t3_3ceged,t5_2qh13
Summer is here? I almost forgot.,t1_ct32kmb,3,t3_3d94xf,ct32kmb,t3_3d94xf,t5_2qh3r
"No his family came when they were kids as ""refugees"", which means they were afraid of harm if they were deported back to their home country. Funny thing is all these people including them went back and forth to their old country WITH NO PROBLEM. They just wanted to leech off us sucker American taxpayers. Oh, and the mother fled when she was caught shoplifting along with some other scumbag relative.",t1_csvch7c,4,t1_csvbjwd,csvch7c,t3_3ceged,t5_2qh13
I'm married. The fun is called football.,,73,t1_cweurgt,cweushu,t3_3qfekn,t5_2vegg
How many times God punished me by giving me bad luck when I might have succeeded otherwise.,t1_csmo9tz,1,t3_3bi6w0,csmo9tz,t3_3bi6w0,t5_2qh1i
Marilyn Monroe got her first part by letting Jack Warner fuck her in the ass.,t1_cngr4wx,38,t3_2rj6pl,cngr4wx,t3_2rj6pl,t5_2qh1i
They go for $196 in the Hamptons.,,1,t3_3m8neo,cvdp4bb,t3_3m8neo,t5_2x93b
They didn't have the Rice tape either.,,2,t3_3k8ctt,cuvph5p,t3_3k8ctt,t5_2rx57
"Oh they arrested a muslim kid with a fake bomb! No it was a clock that he made himself! No it wasn't. He bought it at Walmart. Oh, well scholarship to Harvard invitation to dumbass Obama and cool shit. Muslims fucking rock!",,1,t3_3lwatt,cvagfxl,t3_3lwatt,t5_2uhfi
Those blasted infidels! Jihad on the non believers!,,0,t1_cwpk060,cwpk3ni,t3_3rmmxw,t5_2qh1i
$15 million muthuhfuckas. Pay up rich infidels!,,0,t3_3u06f1,cxbo5cs,t3_3u06f1,t5_2qt55
If black people didn't commit crimes they would not be shot.,,7,t3_3u4ygf,cxcvogd,t3_3u4ygf,t5_2qh1i
Then move to a fucking city you homo!,,-1,t1_cxcvan4,cxcvqnz,t3_3u4ygf,t5_2qh1i
American football fan here. Still watched All Blacks kick LA's ass.,,-1,t3_3qy08v,cwk0wtn,t3_3qy08v,t5_2qhma
Yeah there's no Mexican rapists and murderers. But there is a Santa Claus!,t1_csaqnmv,-24,t3_3a9z5c,csaqnmv,t3_3a9z5c,t5_2cneq
"Since I'm married, it works for me.",,1,t3_3t9jcv,cx4ilkp,t3_3t9jcv,t5_2szyo
Go out of business.,t1_cgj8rrs,1,t3_224a2g,cgj8rrs,t3_224a2g,t5_2qh1i
"Same as Gloucester, MA.",,7,t3_3nxgvu,cvsknst,t3_3nxgvu,t5_2qh2t
We have a Billerica in Mass.,t1_cgvz2p5,1,t1_cgvxp3m,cgvz2p5,t3_23d9l2,t5_2qh1i
"If you don't hire a guide when you step out of the resort, they will never find your body .",t1_cp35onx,1,t1_cp312j7,cp35onx,t3_2xrzhg,t5_2qh1i
"I consulted to the second largest private university in the country. I proposed a solution to their fuckedupness in one department, then got fired because it appeared they didn't really want to fix anything.",t1_cphmsot,2,t3_2za72h,cphmsot,t3_2za72h,t5_2to41
I don't know any companies that promote from within. No company would let you bring your baby into work. Consider yourself lucky.,,1,t3_3vq0n5,cxqni64,t3_3vq0n5,t5_2r2jt
"""Frankly, my dear, I don't give a damn.""",,2,t3_3vya2w,cxs4y3s,t3_3vya2w,t5_2qh1i
Nazi eagle.,t1_cgqazar,2,t3_22ruts,cgqazar,t3_22ruts,t5_2qh0u
"http://mrconservative.com/2013/07/21971-10-facts-that-suggest-obamas-birth-certificate-is-fake/

what do you guys like about Obama? Do you like high taxes? Do you pay taxes? Do you like shitty healthcare? Do you like terrorists killing American ambassadors? Do you like ISIS? Do you like paying for illegal aliens? Come on. out with it. What is there to like?",t1_csypxf6,-5,t1_csypqg5,csypxf6,t3_3cshqh,t5_2cneq
"Hitler executed 20,000 people with the guillotine including a female American spy.",t1_ct38r4n,0,t3_3d8foz,ct38r4n,t3_3d8foz,t5_2qh1e
She's a keepah!,t1_ct72679,1,t3_3di5fg,ct72679,t3_3di5fg,t5_2s7tt
Did that once. Dickburn.,t1_ctlj3cq,2,t1_ctl3q60,ctlj3cq,t3_3f3udx,t5_2qh1i
"Reminds me of the movie ""the Young Lions"" where Marlon Brando plays a German soldier riding a motorcycle with a wounded German soldier in Tunisia saying it was another ten hours before they reached the German lines.",t1_cqzborx,1,t3_34y4jf,cqzborx,t3_34y4jf,t5_2qhsa
"My friend and I were smoking pot in his dorm room. A priest from Nigeria walked in to say hello. We were like, ""Hello Father"". It was awkward until he commented, ""Nice tobacco."" Apparently in Nigeria pot is considered just a another type of tobacco. Then again maybe he was being polite.",t1_cfpfx8f,1,t3_1yzlaa,cfpfx8f,t3_1yzlaa,t5_2qh1i
Can't fault the hustle.,t1_cstutiv,1,t3_3c9pjw,cstutiv,t3_3c9pjw,t5_2qh11
There's a different accent for almost every town in Massachusetts.,t1_ct36o5f,1,t1_ct2z1qf,ct36o5f,t3_3d932l,t5_2qh1i
Hydrants are designed not to do this. It only happens in cheesy movies.,,1,t3_3ulx4r,cxgc8pu,t3_3ulx4r,t5_2qh0u
Yeah but we got Hillary Clinton.,t1_cp45irb,0,t3_2xwixa,cp45irb,t3_2xwixa,t5_2qh0u
"The word gymnasium means naked in Greek, because they were all naked gyms.",t1_cpgkn6u,1,t3_2z6j7w,cpgkn6u,t3_2z6j7w,t5_2qhx4
"59

Pro: I don't care, so nothing upsets me anymore.
Con: What did I just say?",t1_cf62cbr,18,t3_1ww09m,cf62cbr,t3_1ww09m,t5_2qh1i
Somebody in a restaurant in Worcester asked if a picture of the Boston waterfront was of Worcester. I asked them where they were from? Worcester of course.,t1_c9g9lyg,1,t3_1cfls6,c9g9lyg,t3_1cfls6,t5_2qh1i
The Syrians started America? Who knew?,,1,t3_3u5mkl,cxcx2h5,t3_3u5mkl,t5_2s7tt
"""Hello Aleppo police? Do you know Achmed the Goatherder? No? So no crimes from him? O.k."" Come on in Achmed! You're good to go!",,1,t1_cxg4l47,cxgb1v7,t3_3ukd1o,t5_2u489
"Yes we are. In Lawrence, MA a convenience store hauled in $3.5 million in illegal EBT cards and SNAP payments. Get your head out of your ass.",,0,t1_cvln67m,cvlpttz,t3_3n3hu5,t5_2qm21
Age of consent in MA is 16.,t1_cpl5i8c,0,t1_cpl2er8,cpl5i8c,t3_2zoewc,t5_2qh1i
Don't poke the bear.,t1_cnhf29l,1,t3_2rmgra,cnhf29l,t3_2rmgra,t5_2qh0u
Mark Twain's nom de plume did not refer to the depth measurements of the riverboats on the Mississippi but two fingers of whiskey.,t1_cngr1hd,1,t3_2rj6pl,cngr1hd,t3_2rj6pl,t5_2qh1i
It's the west's fault they shit in the streets.,,-14,t3_3uz7m9,cxj9z1t,t3_3uz7m9,t5_2qh1q
"Obtain secret CIA documents on a porn site. Oh, wait, that's a TV show.",,1,t3_3v98uz,cxlnebk,t3_3v98uz,t5_2qh1i
About 2 million Muslims?,,2,t1_cxzn1jz,cxzw44q,t3_3wts9y,t5_2s7tt
Tell that to West Virginia the poorest state in the union.,,7,t1_cxrcgms,cxromxa,t3_3vvsuw,t5_2qh4w
You've never been to Massachusetts apparently.,t1_ct36tbg,3,t1_ct2wkmw,ct36tbg,t3_3d932l,t5_2qh1i
"Global warming with trumped up data, sucking Bernie's commie cock, self entitled lgbt's suing for wedding cakes, calling Trump a joke, hating Republicans, this site sucks.",t1_ct89a3m,-2,t3_3dqiun,ct89a3m,t3_3dqiun,t5_2qh1i
The Ukraine is not weak. O.k. buddy we're playing a game here. THE UKRAINE IS NOT WEAK!,,-3,t3_3wx5za,cxzw7eo,t3_3wx5za,t5_30hhs
Like die?,,1,t3_3v3r7q,cxkp4tt,t3_3v3r7q,t5_2qt55
Syrians are black?,,1,t3_3yg4vt,cydzm8q,t3_3yg4vt,t5_2qh68
In the old days it would be $12 for every Republican before the Massholes emigrated up there.,,2,t1_cy14esz,cy15ib6,t3_3x18v8,t5_2qh0u
Umm the latest maniac was an Islamist non virgin.,,5,t3_3v7tl1,cxlpenq,t3_3v7tl1,t5_2qh8e
I know some slut that did this. My boss screwed her at work ?! He was surprised that when her husband came back she didn't want to do it anymore and got a new job.,,0,t3_3pql9z,cw8yx4a,t3_3pql9z,t5_2qh8y
She is the only non ivy league trained law professor at Harvard. Obviously she wouldn't have been hired if she wasn't a fake Indian.,t1_ch7cid0,-1,t1_cgv8f5d,ch7cid0,t3_239lyl,t5_2qh1i
I didn't. Bush killed the Repubs. McCain and Romney were jokes.,t1_cuhru6i,1,t1_cuhrfnc,cuhru6i,t3_3ik8af,t5_2r2jt
I don't really care about Mexicans getting upset. Fuck 'em.,t1_csnhaf1,-15,t3_3bles4,csnhaf1,t3_3bles4,t5_2qh13
Elizabeth Warren flipped foreclosed houses and rails against banks.,t1_csaxqc9,1,t3_3aa78q,csaxqc9,t3_3aa78q,t5_2qh63
"I think he thought Miguel was developmentally disabled, one of Tom's charities.",t1_cihz58b,0,t3_295ien,cihz58b,t3_295ien,t5_2rdrs
I will tell you that what I did at motels was far from thinking except with my little head.,,-37,t1_cxj6vb1,cxj6wj8,t3_3uzikx,t5_2u82c
He'll sure be exploiting me by taxing me to death.,,2,t1_cxtf41d,cxu1wde,t3_3w2s7o,t5_2rygj
Wow some lazy ass is really happy with your 500 pounds. Too bad you can't pay your rent huh?,,-2,t3_3vsdzf,cxqh3dt,t3_3vsdzf,t5_2ti4h
"You do know that's a scene from ""Curb Your Enthusiasm"".",t1_cpz4h9n,8,t3_316znv,cpz4h9n,t3_316znv,t5_2s7yq
Rahm Emmanuel is human? Who knew?,,-1,t1_cxln5j8,cxlnbwg,t3_3v646s,t5_2qh2t
What a barn burner! NOT! Jesus fucking Cheerist why did I watch that game?,,1,t3_3t4677,cx3i00i,t3_3t4677,t5_2rehg
In MA you only have to stop for them if they are using a crosswalk.,t1_cufcdnk,0,t3_3ibwpt,cufcdnk,t3_3ibwpt,t5_2yrq6
OMG you are all peasants I tell you peasants!,t1_ctrkw9n,-2,t3_3fs46n,ctrkw9n,t3_3fs46n,t5_2qqjc
"""Gratitude is the disease of dogs,"" Stalin.",t1_cqnjp7e,1,t3_33p5ee,cqnjp7e,t3_33p5ee,t5_2qh1i
They captured another ship named So Small Dong.,t1_cq7sm4w,2,t3_323m04,cq7sm4w,t3_323m04,t5_2qh13
Just like stuff.,t1_cqc6dqc,0,t3_32kc9r,cqc6dqc,t3_32kc9r,t5_2qh1i
Yeah he is that stupid. You're too stupid to realize it.,t1_cqb0ova,1,t1_cq81gi5,cqb0ova,t3_3240qm,t5_2r5rp
Whatever you say Obama.,t1_cqnbsa9,-2,t1_cqnayqx,cqnbsa9,t3_33p02a,t5_2tk95
Did he actually fire that? I would be afraid to. Of course ten million dollars was probably chicken feed to him.,,3,t3_3xcifa,cy3oslp,t3_3xcifa,t5_37oez
Bernie's so pathetic.,,-1,t3_3xs2u8,cy82slf,t3_3xs2u8,t5_3arin
"
The next myth to be destroyed is global warming.",t1_cp6g58l,2,t3_2y1l8s,cp6g58l,t3_2y1l8s,t5_2qqjc
A friend of my wife whose husband is of Chinese descent was in Germany. They were trying to get a ticket on a boat and the boat guy ignored them.,t1_cqrmz0z,1,t3_345db3,cqrmz0z,t3_345db3,t5_2qh1i
So does your city have like 3 shootings a night? Also my wife and I make over $250K a year and are barely surviving.,,-6,t1_cwf21nl,cwf31ay,t3_3qeia7,t5_3328c
There's no crying in baseball.,,1,t3_3pr93m,cw8v568,t3_3pr93m,t5_2qh1i
Gangs in Chicago had a real fireworks war with roman candles. Don't think they were doing it for fun.,,-2,t3_3nu2ge,cvrn3nk,t3_3nu2ge,t5_2vi9f
My dad had an English surname and was ashamed to be Irish.,,1,t3_3tf58r,cx62jrj,t3_3tf58r,t5_2qhb9
Can't afford to blow money on strangers for nothing. Already supporting my kids and inlaws.,,1,t1_cx3pllw,cx3pvr9,t3_3t3l0y,t5_2qm21
What about gay terrorists?,,2,t3_3u1369,cxbrw9h,t3_3u1369,t5_2qh68
The contract gasoline lets the owner make one cent a gallon. Think how many tanker trucks a day you'd have to go through to pay the rent.,,-1,t3_3rk66a,cwpkudl,t3_3rk66a,t5_2s7tt
He had a cyanide capsule. Should have. Then he was the LA helicopter traffic guy.,t1_ch7cg8u,0,t3_24gfyc,ch7cg8u,t3_24gfyc,t5_2qqjc
That's why my wife hates Ortho. The kits are about 800 pounds.,t1_cqzc8cv,1,t3_34xzev,cqzc8cv,t3_34xzev,t5_2qh61
 Wat?,t1_csnhd6k,1,t3_3bk7lo,csnhd6k,t3_3bk7lo,t5_2to41
It's a local issue that does not require federal intervention.,t1_ct4q6ve,-3,t1_ct4gbou,ct4q6ve,t3_3ddxhd,t5_2qhh7
"I highly doubt Honolulu would have an IBM 360 up and running the very year it was invented, and I highly doubt they had a Cray.",t1_ct0tpib,0,t1_ct0orgz,ct0tpib,t3_3cshqh,t5_2cneq
They won't.,t1_ct5bulj,2,t1_ct5azez,ct5bulj,t3_3dhkkp,t5_2qh1i
It was just a demonstration about the video. Anyway WHO CARES?,t1_c9y0lmd,0,t3_1e80li,c9y0lmd,t3_1e80li,t5_2cneq
"The guy doesn't have a graduate degree or a science degree you realize. If he thinks we cause global warming I'd like to see the proof. Everything is anecdotal, i.e. ""Antarctica is melting"". No it isn't. Just the microscopic part where humans are.",,-18,t3_3rr1sx,cwqrtyx,t3_3rr1sx,t5_2qh1n
My Muslim acquaintances make fun of me because I'm bald.,,1,t3_3tcpuc,cx5xy2s,t3_3tcpuc,t5_2qh68
Ummm he doesn't have feelings. He's an Irish psychopath.,,2,t3_3u3dhd,cxbt106,t3_3u3dhd,t5_2ra29
The guy that won the game is more like a thousandaire.,t1_co9g8l7,1,t3_2uiwh7,co9g8l7,t3_2uiwh7,t5_2szyo
"The businesses that run the events, e.g. catering, venue rent make more money than the charity and kickback to the ""celebrities"".",t1_coqbcxm,2,t1_coqansh,coqbcxm,t3_2we28r,t5_2qh1i
"If you have private health insurance you will be charged 2 to 3 times what Medicare is charged to make up for the shortfall in government insurance rates. This is called ""cost shifting"".",t1_coqax5j,7,t3_2we28r,coqax5j,t3_2we28r,t5_2qh1i
I had shitty parents. I still did pretty good.,t1_cgynog3,1,t1_cgynm9s,cgynog3,t3_23mdpj,t5_2qh0u
Equipment violation caused by equipment managers. Move on.  The Pats will run the table 19-0.,t1_ctpu4gp,1,t3_3fj6pl,ctpu4gp,t3_3fj6pl,t5_2rx57
"In 2017 it will be ""Bernie who?""",t1_cuhjqaa,1,t3_3ik8af,cuhjqaa,t3_3ik8af,t5_2r2jt
Why do you think Giselle and Tom sold their Brentwood digs?,t1_ctv4yle,2,t3_3g224c,ctv4yle,t3_3g224c,t5_2qhad
You forgot nutcase.,t1_cty7kbs,-1,t3_3gdmff,cty7kbs,t3_3gdmff,t5_2cneq
The traffic is so bad you will have to live within 5 miles of where you work.,t1_cq35906,-4,t3_31n899,cq35906,t3_31n899,t5_2qh3r
Where you guys from Inner Mongolia?,t1_cqc7r60,-1,t3_32kkpe,cqc7r60,t3_32kkpe,t5_2qh33
So where's the illegals?,t1_cty98li,0,t3_3ghi4t,cty98li,t3_3ghi4t,t5_2s7tt
OMG. Just fucking wait. ,t1_cuc4mn3,1,t1_cuc2s56,cuc4mn3,t3_3hybgk,t5_2sn7r
O.k.,t1_cuhjs48,1,t1_cuhjpgz,cuhjs48,t3_3il1g2,t5_2sokd
"Cheddar can be made anywhere, but not real parmesan, which costs a little over a dollar an ounce.",t1_ctrfz5b,-6,t1_ctrf8na,ctrfz5b,t3_3fs46n,t5_2qqjc
These people are completely out of control.,t1_cuch0ug,2,t3_3hyzdc,cuch0ug,t3_3hyzdc,t5_2qh13
Did they shut off her EBT card or something?,t1_ckahgt9,-5,t3_2fks64,ckahgt9,t3_2fks64,t5_2qnts
"Not really. Any party to a contract has a 3 day right of recission in the US. The dealer is exercising it in a disingenous way, but it's perfectly legal, Just drive the car back and cancel the contract.",t1_ci6zrkj,-4,t3_281sf2,ci6zrkj,t3_281sf2,t5_2s5oq
Why is it in English?,t1_cgj2kob,1,t3_222f6l,cgj2kob,t3_222f6l,t5_2qh33
So was Hirohito.,t1_ckhid8v,13,t3_2gataj,ckhid8v,t3_2gataj,t5_2qqjc
There won't be any more unknown soldiers because of DNA tracking.,,1,t3_3s58fj,cwuga7c,t3_3s58fj,t5_2qm21
They should march around the ghettoes at night and see how long they last.,,1,t1_cx3trop,cx3wxhd,t3_3t6se1,t5_2qoyi
Sharing her lunch with her dinner.,,-45,t3_3xxefq,cy936vr,t3_3xxefq,t5_2qh1o
"Well a lot of people got blown up about ten miles away from where I live, so keep your head in the sand until you get attacked.",,0,t1_cy8gbcc,cy8gil5,t3_3xujl9,t5_2qh63
/r/slaverape,,1,t3_3yh9rl,cydwupx,t3_3yh9rl,t5_2qh1i
"The crips and bloods declared a truce, and now the property values are skyrocketing.",,6,t1_cy6k7uc,cy6lste,t3_3xok9f,t5_2qh1i
The gangbanger was only following Clint Eastwood's advice and trying to arm himself. A little too late though.,t1_cjolrk7,-2,t3_2dcgn2,cjolrk7,t3_2dcgn2,t5_2qh3l
"Oh, they're racist alright. What if whites went around marching about white lives mattering to protest all the black crime against whites?",,29,t3_3t6se1,cx3nocm,t3_3t6se1,t5_2qoyi
Ummm because they no speak English?,,1,t3_3tuv3i,cxaahwk,t3_3tuv3i,t5_2qqjc
Geniuses are bat shit crazy.,,1,t3_3tbuv8,cx4vcx0,t3_3tbuv8,t5_2qqjc
"Donald Trump to department head ""You're fired.""",,-8,t3_3x3u4t,cy1ek45,t3_3x3u4t,t5_2sfg5
Off topic: What is r/politics the Bernie Sanders support sub?,,1,t3_3w2cuc,cxt14va,t3_3w2cuc,t5_2qh13
I find it hilarious that the Boston Globe and boston.com keep pretending they're separate entities.,,2,t3_3w9as0,cxvf02k,t3_3w9as0,t5_2qh3r
"He's only a ""child"". Boofuckinghoo.",t1_cmcoxia,1,t3_2ndfuo,cmcoxia,t3_2ndfuo,t5_2qh0u
"Do illegals have to pay them, or do we pay for all their shit?",t1_ciq2rl8,1,t3_29yqe6,ciq2rl8,t3_29yqe6,t5_2qh3l
Noam Chomsky was the linguist that originally told this joke.,t1_cmngq2s,3,t3_2oh3pa,cmngq2s,t3_2oh3pa,t5_2qh72
Naw. You be fine!,t1_cltx02x,3,t3_2ldyju,cltx02x,t3_2ldyju,t5_2qstm
Popeye's rules!,t1_cgi7hhn,1,t3_22092w,cgi7hhn,t3_22092w,t5_2s7tt
"My mother in law bought me a piece of cloth. Didn't know what it was. 
She went shopping on xmas eve at like 11 at night.",t1_cgk6wdp,3,t3_2274lo,cgk6wdp,t3_2274lo,t5_2qh1i
They just want welfare paid for by us. Btw I am related to a Mexican American who agrees with me. ,,-6,t1_cvkpg52,cvksuyu,t3_3n3hu5,t5_2qm21
So you're God?,,0,t1_cwfm3zn,cwftvzy,t3_3qelsy,t5_2qh13
Vikings wanted to misdirect people.,,9,t1_cwemefx,cwemqsp,t3_3qelsy,t5_2qh13
What a nutcase.,t1_cqtv2fb,-11,t3_34cajf,cqtv2fb,t3_34cajf,t5_2cneq
and...the Bengals suck.,t1_cgq6029,-1,t3_22s9gc,cgq6029,t3_22s9gc,t5_2qh33
Playing on a pro football kickoff team. Might not survive.,t1_cgj8em1,1,t3_223je2,cgj8em1,t3_223je2,t5_2qh1i
"Me too. If they don't get enough money back they don't come back the next year. Sorry, I don't break the rules. You (and I) would get caught anyway. I specialize in business returns, because people who want individual returns done are usually scum.",t1_cgyi9m4,1,t1_cgyfmfb,cgyi9m4,t3_23lgxz,t5_2qh1i
I lived in Iowa for a couple of months in the winter. -25F 40 mph gusts. Makes Massachusetts seem downright tropical. -3 here today even with hurricane winds isn't like Iowa. Iowa is like living on Neptune.,t1_cnj2irp,2,t3_2rqr9t,cnj2irp,t3_2rqr9t,t5_2qh33
Really really complicated and don't get it.,t1_cp6c8fb,1,t3_2y3blm,cp6c8fb,t3_2y3blm,t5_2to41
"I thought they had ""free"" healthcare. America's healthcare is so bad why are they coming here? BTW my wife is an OR nurse and they perform these operations at her hospital.",t1_ct3868a,-8,t3_3d9332,ct3868a,t3_3d9332,t5_2qh11
Fung Wah go away! They were bad men!,t1_cthpbgx,1,t1_cthnz0s,cthpbgx,t3_3eq49g,t5_2qh3s
When it's 13 degrees and snows every day you're not gonna spend money on nice clothes that aren't warm and will get ruined by sluch and road salt.,t1_ct5qmvw,6,t1_ct5qavx,ct5qmvw,t3_3djc98,t5_2qh3r
Guy drank Absinthe in Spain. Fell off his barstool. Got back on. Was told he fell off his barstool because he didn't remember. Went out and stole a motorcycle and rode it up to the summit of a mountain.,t1_cuffg0l,1,t3_3ibku6,cuffg0l,t3_3ibku6,t5_2qh1i
Alright illegals! We don't need no stinkin' greencard gringo!,t1_ctv50ng,-2,t3_3g42kk,ctv50ng,t3_3g42kk,t5_2qts0
I'm bald too.,t1_cfqj2vn,1,t3_1z40p1,cfqj2vn,t3_1z40p1,t5_2qh33
No that's what everyone says to me when they meet her and enthusiastically at that.,,-3,t1_cwvgnl4,cwvi9n2,t3_3s9hmw,t5_2qh0u
"Well the Tsarnaevs killed a bunch of people and they WERE FUCKING ""REFUGEES"" on welfare too.",,1,t1_cx714ws,cx72f5i,t3_3tjzrj,t5_2s7tt
The DAESH says they're going to sneak in and attack you. O.k. let's bring in more refugees! Got it.,,1,t3_3t96ye,cx4hl4y,t3_3t96ye,t5_2qh9a
It's obviously trained to do this as a stunt.,,2,t3_3t7fcv,cx4h565,t3_3t7fcv,t5_2qh33
"M4, which is the military version of an AR 15 carbine.",,-2,t1_cwwqwu3,cwwsq5k,t3_3seukr,t5_2qh3l
Pretty much.,,-2,t1_cwfhk1u,cwfset3,t3_3qeia7,t5_3328c
"It doesn't totally have to be a copy. Marvin Gaye's family sued Robin Thicke over ""Blurred Lines"" just because the party sounds were so similar to ""Got to Give It Up"", which even a dummy like me noticed. They won.",,1,t3_3yn11p,cyez30g,t3_3yn11p,t5_2ti4h
I had a gay teacher who once a year would stand on his desk and read Le Petite Prince.,,2,t3_3v5502,cxkubmg,t3_3v5502,t5_2rxrw
Maybe these aborigines have a habit of not paying?,,6,t3_3ygovs,cye006l,t3_3ygovs,t5_2qh8e
"Actually the death rate is ""only"" 3%.",t1_cnqzue9,3,t1_cnqxpcf,cnqzue9,t3_2slon3,t5_2raed
http://www.telegraph.co.uk/news/celebritynews/8576018/Arnold-Schwarzeneggers-mistress-speaks-for-the-first-time.html,,-5,t1_cxrpnt9,cxrrydo,t3_3vx9uv,t5_2qm7x
Was it Bunny Wailer's kid?,,1,t3_3yhusi,cydzoea,t3_3yhusi,t5_2s7tt
"Yeah my ancestors went right to the welfare office. Then they put them in the stocks. Oh I'm ""doing that too much again"" am I? Why can I post my ass off until I post a political statement then ""I'm doing that too much.""? Is fucking Castro the moderator?",,1,t3_3xash8,cy3o7j1,t3_3xash8,t5_2t776
What's snow? I'm from 2015 Massachusetts.,,3,t3_3x1fd5,cy175nb,t3_3x1fd5,t5_2ti4h
Instead of buyin' dat house and gettin' a mortgage get a student loan so we done get paid yo?,,4,t3_3v3oii,cxkcjm1,t3_3v3oii,t5_33x33
Cossacks: stern but fair.,t1_cfjfvbm,-7,t3_1ycuei,cfjfvbm,t3_1ycuei,t5_2qh1e
Best pope ever.,t1_cgo5uqm,-2,t3_22lk1u,cgo5uqm,t3_22lk1u,t5_2qh1e
"Obama thought he actually made a clock. But then Obama thinks there are 57 states, Hawaii is in Asia, and global warming is real.",,0,t3_3umtyl,cxgb85m,t3_3umtyl,t5_2qh1e
KKK murdering innocent negroes.,,2,t1_cx8m7vg,cxdyqdn,t3_3tqzed,t5_394gw
"I'm talking about federal and state income taxes not local property taxes. I have to pay a fee for my trash. Quit telling me about the ""poor people"". If you're not disabled or elderly or mentally handicapped you should be looking for a job and not getting welfare. In my state the welfare fraud rate is probably about 60%.",t1_cu1wdr6,0,t1_cu1lkpt,cu1wdr6,t3_3gppuh,t5_2qh0u
"He was not in a ""public space"". He was trespassing on private property at a bank. Took a while to find this out with all the propaganda about the ""public space"".",t1_ck3bayx,3,t3_2eu75z,ck3bayx,t3_2eu75z,t5_2qh3l
Engrish prease.,,2,t3_3m71sn,cvcpyip,t3_3m71sn,t5_2vizz
I think you can do this in the Mideast. I call bullshit or cowshit.,,0,t3_3km9w9,cuzdu9y,t3_3km9w9,t5_2qh2p
I have one friend. I go out one day a week.,,103,t3_3qfekn,cweum6t,t3_3qfekn,t5_2vegg
Like to see what would happen if they tried to get into Russia.,,0,t3_3la04u,cv4ufl5,t3_3la04u,t5_2qh0u
Funny thing is very little of their money goes to research FOR THE CURE.,,2,t3_3pnhlf,cw85e67,t3_3pnhlf,t5_2qqjc
"Formula ""E"". Never heard of it until now.",t1_ckhjal5,1,t3_2ga0mx,ckhjal5,t3_2ga0mx,t5_2qgzy
Why doesn't he start with the gangs in his home town. Let's see how that would work out.,t1_cgnb76b,3,t3_22i6cp,cgnb76b,t3_22i6cp,t5_2qh3l
"Naw, really? I thought the FBI just gave out parking tickets.",t1_cttotep,5,t3_3fy7zg,cttotep,t3_3fy7zg,t5_2cneq
Do you own this house? No. (It's owned by a trust so GTFO).,t1_cjoihgv,1,t3_2dbxrt,cjoihgv,t3_2dbxrt,t5_2qh1i
Illegal in Mass.,t1_cr6r6sc,1,t3_35pi4a,cr6r6sc,t3_35pi4a,t5_2qt55
American football is for pussies pads and mouthguards and all.,t1_chqbttl,-1,t3_26d77y,chqbttl,t3_26d77y,t5_2qgzy
You do know that the turbines are obsolete.,t1_cra7xqu,1,t3_361phv,cra7xqu,t3_361phv,t5_2qh1n
"Thank you Deval Patrick for this, the deaths of patients from the poison pharmacy, the one billion dollar health connector fuck up, the millions of dollars of junkets,the millions wasted on your friends' ""green energy' scams, the murders of children in DCF custody with no prosecutions. Thank you!",t1_csaugyx,8,t3_3aacs0,csaugyx,t3_3aacs0,t5_2qhk3
Obama is a terrorist Muslim. We'll have WWIII soon with that idiot.,t1_cq7x5yb,-15,t3_3242fa,cq7x5yb,t3_3242fa,t5_2qh2p
If you print the label yourself it's only $5.05 BUT the 2 days isn't guaranteed.,,1,t3_3tvi4b,cxa813q,t3_3tvi4b,t5_2s7tt
So? Why don't you house the fucking Islamists yourself?,,-1,t3_3tbfrk,cx58ydo,t3_3tbfrk,t5_2s7tt
"When I turned 16 my mom decided it was time I start earning my keep because my dad was an inveterate drunk who was not home at this time. So she drives me up to this sketchy beach area (think Coney Island) kicks me out of the car, and makes me walk up and down the beach asking sketchy people in booths selling fried dough and other shit for a job. They all sort of stared at me like ""why is this middle class looking kid walking around and asking for a job from me?""

She never tried it with my brother because of course Jesus Christ Incarnate doesn't need to do any work.

She's apparently on her deathbed 3,000 miles away as Jesus Christ Incarnate just sent me a text. I didn't answer it and intend never to speak to her or him ever again.",,13,t3_3w7ui2,cxuv5wz,t3_3w7ui2,t5_2qh1i
He wanted to skate that's why.,,1,t1_cy7cpqw,cy832yz,t3_3xrr0f,t5_2qrrq
In the US probation is illegal but anyone can be shitcanned at any time for no reason.,,1,t1_cygyclb,cyhbh4r,t3_3yp7n6,t5_2s7tt
A bunch of thieves wanted to pocket tax money so that they could profit pretty much. And when is the Globe going to go away? I'm waiting with bated breath as their losses keep piling up.,,10,t3_3ysf0f,cyghr3v,t3_3ysf0f,t5_2qh3r
O.k. Peter Pan.,,-1,t1_cy2ftl2,cy2g143,t3_3x7bic,t5_2qh2p
So was Obama.,t1_cuhid76,1,t3_3ihyz5,cuhid76,t3_3ihyz5,t5_33x33
Troll.,t1_cu9mi5r,8,t3_3hpfzn,cu9mi5r,t3_3hpfzn,t5_2qjvn
I used to be a professional dishwasher. Absolutely refuse to wash dishes by hand or even rinse them before loading dw.,t1_c9rs6fv,2,t3_1dme6j,c9rs6fv,t3_1dme6j,t5_2qh1i
"Holidays. People offer me cakes, candies, etc. ad nauseum. I tell them I can't eat them, and they say you don't look fat,etc. Finally I have to tell them I'm diabetic so they are not offended. Woohoo!",t1_cltvxns,1,t3_2le12g,cltvxns,t3_2le12g,t5_2qh1i
k. The guy's a Rhodes scholar too.,,2,t1_cweljys,cweminh,t3_3qcuok,t5_2rx57
I have to practically threaten my customers with jail time to get them to pay me. How can I get into your industry?,,1,t3_3povfm,cw8wnyd,t3_3povfm,t5_2s7tt
"""You're fired."" Hops, skips, and jumps to unemployment office.",t1_cgn5v3d,1,t3_22ihk0,cgn5v3d,t3_22ihk0,t5_2qh1i
