body,name,score,parent_id,id,link_id,subreddit_id
"Putin will go the way of Kruschev once Obama is gone,",t1_cg5bgo6,0,t3_20myzo,cg5bgo6,t3_20myzo,t5_2qh13
Unfortunately the Krauts had these things called airplanes.,t1_chqbpsq,1,t3_26dvan,chqbpsq,t3_26dvan,t5_2qqjc
I used to not want to talk to anyone and be left alone because my parents told me I talked too much when I was little and were somewhat cruel to me. I started my own business and also work for a consulting firm. It took years but I finally don't have that stomach churning anxiety I used to have talking to new people and selling them on stuff. ,t1_cfr4xoc,1,t3_1z6fx3,cfr4xoc,t3_1z6fx3,t5_2qh1i
That the Normans beat the Saxons in 1066. My wife's ancestors were Normans. Mine were Saxons.,t1_cgic1l9,1,t3_220trw,cgic1l9,t3_220trw,t5_2qh1i
"Yes, if they work on Wall Street.",t1_ckag4ca,-2,t3_2fkgfd,ckag4ca,t3_2fkgfd,t5_2rmfx
Is there any reason you're not married?,t1_cka9khk,-2,t3_2ficq8,cka9khk,t3_2ficq8,t5_2to41
MRE= meals rejected by Ethiopians,t1_cgj4vy9,28,t3_223b0k,cgj4vy9,t3_223b0k,t5_2qh13
It was written in WWII. He should be explaining it to your uncle.,t1_cn8thvi,1,t3_2qnzoe,cn8thvi,t3_2qnzoe,t5_2qh33
Don't have kids. You'll be working until you die.,t1_cnah5jg,24,t3_2qxgto,cnah5jg,t3_2qxgto,t5_2r2jt
Lively up yourself doctor.,t1_cg5bkle,2,t3_20nw3l,cg5bkle,t3_20nw3l,t5_2s7tt
Ummm...they're facing each other?,t1_cged4y7,3,t1_cged1c9,cged4y7,t3_21l4mz,t5_2qh1i
"No offense but I believe there are a lot of Obama boiler room people posting here and lying out their asses. ""It was no problem. I signed up in fifteen minutes and the insurance only costs $65 a month"" said nobody ever,",t1_cfjhqq5,-5,t3_1ycl5o,cfjhqq5,t3_1ycl5o,t5_2qh1i
Went to a topless beach in Jamaica. Some women should wear burkas especially 250 pound grannies. Still can't get the images out of my brain.,t1_cgj04qh,0,t3_222ni6,cgj04qh,t3_222ni6,t5_2qh0u
I have a philosophy degree. ,t1_chrss5c,1,t3_26k0bf,chrss5c,t3_26k0bf,t5_2qh1i
In WWI a lot of British conscripts were not accepted because of widespread malnutrition.,t1_cgn596c,1,t3_22gyia,cgn596c,t3_22gyia,t5_2qqjc
Not if the person doing her is under 18.,t1_chb4iy3,0,t1_cgj2vbc,chb4iy3,t3_223k8z,t5_2qh33
"""Sorry but we're out of orange soda today.""",t1_cmcple1,2,t3_2nchx0,cmcple1,t3_2nchx0,t5_2qh1e
Welcome to the new Detroit.,t1_ck1ffmj,0,t3_2en48w,ck1ffmj,t3_2en48w,t5_2qh33
"I worked with this person who was in charge of four mental health clinics. She hired all her friends in secretarial positions. Whenever you called three clinics to find her ""she was not there"". When you called the fourth ""she stepped out for a minute"". Actually she was running her own art gallery full time and never showed up for work. Her boss was clueless for about a year despite complaints, since he never set foot in the clinics either. Also she and her friends were black, so they had that going for them.",t1_cnadtzh,1,t3_2lxdef,cnadtzh,t3_2lxdef,t5_2vjvl
You do know that that's the first symptom of ebola.,t1_cgq4ay5,0,t3_22s5zv,cgq4ay5,t3_22s5zv,t5_2qh33
Friends.,t1_cj9cj2l,1,t3_2bux71,cj9cj2l,t3_2bux71,t5_2qh1i
Sounds like this scene from Four Lions: https://www.youtube.com/watch?v=uVNCyp4Verc,t1_cnahenj,5,t3_2qww7t,cnahenj,t3_2qww7t,t5_2qh13
Then you went to your dream house in the trailer park.,t1_cgqawk5,-2,t3_22smsn,cgqawk5,t3_22smsn,t5_2qh0u
Fuck you you fucking fuck.,t1_chte52b,1,t3_26omjr,chte52b,t3_26omjr,t5_2qh1i
Gee you Germans plan everything.,t1_cihz42o,2,t3_294ydw,cihz42o,t3_294ydw,t5_2qh55
We invented airplanes. It would take a long time and zillions of dollars to take a mag lev train from NYC to LA.,t1_cm6ap6z,2,t3_2mp7p0,cm6ap6z,t3_2mp7p0,t5_2qh1i
I won my hearing. Didn't get paid until 5 months later when I had a new job. Thank you wonderful hacks of Massachusetts.,t1_cgoaikq,2,t3_22lxwk,cgoaikq,t3_22lxwk,t5_2s7tt
Sleeping.,t1_cgm9w8x,3,t3_22f1qu,cgm9w8x,t3_22f1qu,t5_2qh1i
Congratulations! Here's your tax bill for $15K.,t1_cgn62xw,1,t3_22gwfa,cgn62xw,t3_22gwfa,t5_2qh1e
"I don't think employers are going to give everyone a $22,000 raise when they dump it.",t1_cj4ghdy,15,t1_cj4eeur,cj4ghdy,t3_2bdw7h,t5_2qh53
Ants aren't a species.,t1_cgi5ab1,2,t3_21z7lo,cgi5ab1,t3_21z7lo,t5_2qqjc
"I guess Obama doesn't give two shits about his little ""settled law"".",t1_cfkddyc,-7,t3_1yg30d,cfkddyc,t3_1yg30d,t5_2qh3l
"My mom is 84, got hit by a car, and is still alive. ",t1_cfjgdwo,1,t3_1ycw8w,cfjgdwo,t3_1ycw8w,t5_2qh1i
Cabin Boy,t1_cfkbbk3,1,t3_1yfsaz,cfkbbk3,t3_1yfsaz,t5_2qh1i
The TV feed is on a four second delay.,,1,t3_3koa13,cuzackr,t3_3koa13,t5_2qh1e
"Soulmate. Probably about 100,000+ people could qualify as your soulmate if you met them.",,3,t3_3kev21,cux3wo6,t3_3kev21,t5_2qh1i
She had 11 crashes. 11.,,1,t3_3k5kkl,cuvs2ml,t3_3k5kkl,t5_2t5y3
"http://www.theblaze.com/stories/2013/11/21/obamacare-contractors-with-ties-to-white-house-obama-campaign-scrutinized/

What's a ""county""? What's a ""contract acquisition""? We're talking federal no bid multi billion dollar contracts here not county road maintenance.",,1,t1_cvd4dgr,cvd52pn,t3_3m6zoy,t5_2qh3l
nice landing strip. I would.,t1_cghrw66,1,t3_21x7vy,cghrw66,t3_21x7vy,t5_2qq5c
They take their welfare money and deal drugs?,,-4,t1_cwf63ld,cwf66fx,t3_3qeia7,t5_3328c
"Confiscate Europeans' houses and rent rooms at hotels like they do here with the ""homeless"".",,1,t1_cw8fu1y,cw8slrg,t3_3pn31z,t5_2qh13
Global warming crap? I'd block it too!,t1_csc7fct,-2,t3_3ae2tf,csc7fct,t3_3ae2tf,t5_2qh13
Elizabeth Warren who only got her professorship at Harvard Law by lying about being a Cherokee. The only Harvard Law professor without an Ivy league law She checked the box and then some.,t1_cguzxfb,-3,t3_239lyl,cguzxfb,t3_239lyl,t5_2qh1i
Probably like Stalin of a heart attack or stroke with everyone keeping their distance including the doctors.,t1_cj94tsf,2,t3_2buvfr,cj94tsf,t3_2buvfr,t5_2qh1i
I thought the Norden bomb sight was still classified.,t1_cn2jxh7,1,t3_2q3db7,cn2jxh7,t3_2q3db7,t5_2qh53
O.k. then don't let in any men.,,1,t1_cxaj453,cxajzmw,t3_3tuxy9,t5_2qh13
"Go to a motel room and write down everything you want to do. I don't think Musk ever did that, and it sounds stupid. If you don't know what you want to do you're an idiot.",,-49,t1_cxj69og,cxj6pp3,t3_3uzikx,t5_2u82c
Kinda stupid myth if you ask me. Like car battery makers intentionally make batteries than wear out. No they don't. Because if a competitor made a battery that lasted forever they would dominate the  market at the right price.,,0,t3_3yrxyu,cygbu1z,t3_3yrxyu,t5_2rete
My state has more people than Norway. Both countries combined only have 3% of the US population. So easy to do with no ghettoes I guess.,,1,t1_cxzntnj,cxzw2cn,t3_3wts9y,t5_2s7tt
At least they don't help rapists and murder people like Hillary.,,-8,t3_3x2g99,cy1ak3a,t3_3x2g99,t5_2qlqk
"White people do care about racism , but when almost every fucked up behavior or crime is the result of a minority it gets kind of grating when all these minorities get up in your face when their behaviors contribute to a lot of racist attitudes in the first place. Every time a minority gets shot by a cop they should not TECHNICALLY be killed, but their behavior is not normal peaceful behavior. They're assaulting a cop or dancing around waving a knife on PCP or pulling a ""toy"" gun out of their belt. WTF?",,0,t3_3yps1y,cygizo1,t3_3yps1y,t5_2w2s8
Holy shit!,,0,t3_3wj07o,cxwvuum,t3_3wj07o,t5_2tz1e
They can do anything they want. If they lose money the taxpayers bail them out. Also the branches continually reduced their hours. I got an offer from Citizens for a free business account and dumped their $13 a month account.,,1,t3_3w9eq6,cxup3kn,t3_3w9eq6,t5_2qh33
In WWII the American troops complained that the Aussies were a bunch of drunken slackers. ,t1_ci1wk1q,1,t3_27jnxd,ci1wk1q,t3_27jnxd,t5_2qh1i
It's a room untouched by woman's hands.,,1,t3_3se7vn,cwws1ip,t3_3se7vn,t5_2ske1
I guess her new commercial about how great she is was timely.,t1_cr1i6s8,1,t3_354y40,cr1i6s8,t3_354y40,t5_2qh6e
Burn and return.,t1_crhdxaw,2,t3_36uh3l,crhdxaw,t3_36uh3l,t5_2x93b
"CFO: Nothing. We get fired all the time. Scapegoats of the CEO, who never gets fired. We always get hired again after two years of looking. Don't do this.",t1_cnj27pa,1,t3_2rqpq4,cnj27pa,t3_2rqpq4,t5_2qh1i
There's a big jar of candy in front of my desk that everyone's eating and commenting on. I'm diabetic. :(,t1_cluxxd6,1,t3_2lhh0j,cluxxd6,t3_2lhh0j,t5_2qh1i
The Dems and RHINOS all hold the same positions. The only one different is Trump.,,0,t1_cy7mp6b,cy7xgdl,t3_3xse3o,t5_2s7tt
I don't know. I live in a white area so not a lot of gun deaths.,,1,t3_3wu1by,cxzyhop,t3_3wu1by,t5_2tk95
What about the Compton cowboys?:http://www.npr.org/2015/04/30/403353200/comptons-cowboys-keep-the-old-west-alive-and-kids-off-the-streets,,2,t1_cy6vn7x,cy6z3lb,t3_3xok9f,t5_2qh1i
"Well the Ukraine girls really knock me out
They leave the West behind
And Moscow girls make me sing and shout
That Georgia's always on my mind",,6,t3_3x29p7,cy1b6pi,t3_3x29p7,t5_2tycb
"I guess you're going to have to do all this stuff without the aid of a say, a CARDIOLOGIST, when Obamacare takes full effect.",t1_cii370e,-2,t1_cii32t6,cii370e,t3_295ln2,t5_2qh1i
That film wasn't really very good.,,-7,t3_3vtcru,cxqklvf,t3_3vtcru,t5_2qh3s
Rissoto.,,1,t3_3v9vry,cxlwn3c,t3_3v9vry,t5_2qh1i
The Mafia.,,1,t3_3vx6er,cxrk9on,t3_3vx6er,t5_2qh1i
Patton died on his way to or from a whorehouse. The Russians killed him.,,1,t3_3voulu,cxqbuaq,t3_3voulu,t5_2qh1i
"LOL! You do know that her ""husband"" is a rapist that she enabled don't you?",,1,t3_3xtyh7,cy8h6ep,t3_3xtyh7,t5_2r2jt
Why don't they go into the ghetto and try this with gang bangers?,,5,t3_3x2kr7,cy19eji,t3_3x2kr7,t5_2ryez
Did a great job getting people killed in Benghazi then not taking any responsibility.,,-2,t3_3t5dpg,cx3j2m1,t3_3t5dpg,t5_2sfmf
"Woman from Germany dissed our ""trains"". I told her one could fit 28 Germanys in the US, and that's why we invented the airplane.",t1_cgifmkr,0,t3_220fl3,cgifmkr,t3_220fl3,t5_2s7tt
I don't think he ever actually killed anyone by that comment.,t1_cgw158u,2,t3_23d3a7,cgw158u,t3_23d3a7,t5_2s7tt
I close mine and a cat gets trapped.,t1_cnq33ew,53,t1_cnpxosq,cnq33ew,t3_2sj2fz,t5_2qh1i
Where I live.,t1_ctw8scx,1,t3_3g8xcy,ctw8scx,t3_3g8xcy,t5_2qh1i
Wharton business school does not take stupid people lightly.,t1_cucj7c1,-1,t1_cucj2l7,cucj7c1,t3_3i1lnv,t5_2qn70
WISTA!,t1_cq356g9,1,t3_31j16n,cq356g9,t3_31j16n,t5_2qh3r
shit myself.,,1,t3_3u8eul,cxcyf6n,t3_3u8eul,t5_2qh1i
Coming to USA soon!,,9,t3_3w7vr5,cxu77ps,t3_3w7vr5,t5_2qh13
I thought he was talking about Obammy.,,-1,t3_3x0ejk,cy18fhz,t3_3x0ejk,t5_2t5y3
I would not go out there.,t1_ckaheu1,0,t3_2flhcf,ckaheu1,t3_2flhcf,t5_2sbq3
You sure they're alive?,t1_cgna8in,1,t3_22itbn,cgna8in,t3_22itbn,t5_2qh0u
"Putting the gas cap back on my car. Never goes smooth especially if it's cold, windy,snowing, and/or raining.",t1_cgngjys,1,t3_22ir9l,cgngjys,t3_22ir9l,t5_2qh1i
I'm still waiting for you to cite previous instances of global warming catastrophes. LOL.,,0,t1_cwew2uv,cwex5pj,t3_3qelsy,t5_2qh13
She has to be controversial because her music sucks.,,0,t3_3oyass,cw27hv6,t3_3oyass,t5_2qh1e
How much did they pay you to do that?,,0,t3_3ncnmx,cvn57bb,t3_3ncnmx,t5_2qm7u
"If it weren't for the US armed forces you'd be goose stepping around and sieg heiling all over the place. But feel how you feel. The muslims are going to cut your heads off, and we're not lifting a finger this time.",,1,t3_3qk7r7,cwg9afy,t3_3qk7r7,t5_2s7tt
Conway Twitty!,t1_ctja8ci,0,t3_3evrr6,ctja8ci,t3_3evrr6,t5_2tyoq
"You actually do have that right except for the elderly and protected classes of minorities.

Although the First Amendment does not explicitly mention freedom of association, the Supreme Court ruled, in National Association for the Advancement of Colored People v. Alabama (1958),[227][228] that this freedom was protected by the Amendment and that privacy of membership was an essential part of this freedom.[229] The U.S. Supreme Court decided in Roberts v. United States Jaycees (1984) that ""implicit in the right to engage in activities protected by the First Amendment"" is ""a corresponding right to associate with others in pursuit of a wide variety of political, social, economic, educational, religious, and cultural ends.""[230] In Roberts the Court held that associations may not exclude people for reasons unrelated to the group's expression, such as gender.[231]",t1_csoq7p4,1,t1_csodthy,csoq7p4,t3_3bmfff,t5_2s7tt
"This explains it all:

https://www.youtube.com/watch?v=EwTZ2xpQwpA
",t1_cpipwrs,6,t3_2zg76b,cpipwrs,t3_2zg76b,t5_2qh3l
Ummm HAHAHAHAHAHAHA!,,0,t3_3u5fn3,cxcx5bh,t3_3u5fn3,t5_2s51j
Already have to deal with it. 28 grams to an once. Kilo is about 2 pounds.,t1_cevbe70,1,t3_1vpts3,cevbe70,t3_1vpts3,t5_2qh1i
Let your employees out early then send an email about how horrible they are that they are happy not to be at work.,t1_cmzmw1b,1,t3_2pqn5r,cmzmw1b,t3_2pqn5r,t5_2qh1i
No you get a dollar for dollar credit for foreign taxes paid.,t1_cmxr20h,1,t1_cmxp2pj,cmxr20h,t3_2pkkyp,t5_2qh1i
I dunno take it up with the Mass. legislature. I don't make any laws.,t1_chb4jep,1,t1_cgj0z3x,chb4jep,t3_222mz4,t5_2s7tt
"Was a financial consultant at a small music conservatory. To compete with Jiulliard, etc. most of it went to scholarships.",t1_cm2og6r,1,t3_2mayfs,cm2og6r,t3_2mayfs,t5_2sokd
The only messages the govt should deliver is notice of tax refunds not stupid health admonitions like don't smoke: don't fuck other men up the ass. If people don't know that shit they're too stupid to live anyway.,,1,t1_cyaleaw,cyap4g2,t3_3y1sb2,t5_2qh3p
Did it get into the EU?,,2,t3_3x54u1,cy2kdzo,t3_3x54u1,t5_2qh0u
Yeah and get shot by mussies that declared  they were terrorists on Facebook and had tens of thousands of dollars in overseas money transfers. Nice going FBI! Really nailed it!,,2,t1_cxrj0wv,cxrj8u0,t3_3vw3ez,t5_2s7tt
"I charge the same to ""review"" a return as I do to prepare it from scratch. In  fact I should charge more because it's more work.",t1_cfjfczh,1,t1_cfgnqpk,cfjfczh,t3_1y1jiu,t5_2qh1i
This happened at a shopping center near me. It was kind of fucked up that a guy with an umbrella would cause such a ruckus.,t1_cmm83wy,4,t3_2odpf2,cmm83wy,t3_2odpf2,t5_2to41
Gratitude is the disease of dogs.-- Stalin.,t1_cm78z0z,1,t3_2mrede,cm78z0z,t3_2mrede,t5_2qh1i
Thanksgiving.,t1_cgo5831,1,t3_22lk6n,cgo5831,t3_22lk6n,t5_2qh1i
You guys have Christmas in the summertime. Sickos.,,1,t3_3x7f3i,cy2dydd,t3_3x7f3i,t5_2qh1i
"CNBC's John Harwood then said, ""It was 90. When you think about 90 percent, you don't think that's obviously too high.""

Sanders replied, ""No. What I think we've seen, and what frightens me again, when you have the top one-tenth of 1 percent owning almost as much wealth as the bottom 90 percent. Does anybody think that that is the kind of economy this country should have? Do we think it's moral?
",,1,t1_cxvf8tf,cxvfdcr,t3_3wa76y,t5_2vhdb
Same company.,,2,t1_cxtzlr5,cxu7nni,t3_3w5au1,t5_2qh0u
Just hang roach clips and condoms from it like the Billary Clintons do.,,1,t3_3v3bpg,cxkcdj6,t3_3v3bpg,t5_2qh33
Why is he dressed like Mr. Chips?,,1,t3_3x5d59,cy2a611,t3_3x5d59,t5_2qh33
"""Just sayin'"". My wife says this all the time to get a rise out of me. Also ""at the end of the day"", which Clinton used a lot.",t1_coz2q0w,0,t3_2xc9yr,coz2q0w,t3_2xc9yr,t5_2qh1i
"The Brazilian government has ordered military operations to rehearse defense of the Amazon basin against perceived future invasions by the United States. The resources of the Amazon basin in the Brazilian government's viewpoint include untold and undiscovered mineral and genetic assets of incalculable value ,which would at some point have to be be defended by military force.",t1_clxwop7,3,t3_2lt58f,clxwop7,t3_2lt58f,t5_2qh3l
"I told someone my cat bites so don't pat him. They said no he doesn't and patted him.  The cat bit them. ""Your cat bit me!"" they cried.",t1_cf06eg9,23,t3_1wa02m,cf06eg9,t3_1wa02m,t5_2qh1i
A Batman pin and a thing from the producers of the Grudge that made the weird Grudge noises.,t1_cfl3u4a,1,t3_1yjbsa,cfl3u4a,t3_1yjbsa,t5_2qh1i
"Come to Massachusetts in August and September. We have 1,500 lady bugs per cubic foot, and they're free! Take them! Please!",t1_cghi0qo,1,t3_21uwrr,cghi0qo,t3_21uwrr,t5_2qh0u
Oh just a little bombing in Boston. Nothing important.,,0,t1_cy8jcgq,cy8jf0z,t3_3xujl9,t5_2qh63
Why doesn't he fly on a 747 with all his in laws like his fellow liberal in the US?,,1,t3_3wumhp,cy05xfj,t3_3wumhp,t5_2qh68
They get welfare. The live in bf deals drugs. Then they shoot each other.,,-4,t1_cwf3va7,cwf5kvy,t3_3qeia7,t5_3328c
Gang bangers pay attention to gun laws?,,0,t3_3xso38,cy8iqr2,t3_3xso38,t5_2qham
Jerking off in front of chicks (who want me to).,t1_cgiffxs,2,t3_220th2,cgiffxs,t3_220th2,t5_2qh1i
Why the hell would we let in disabled people?,,-5,t1_cxud9ry,cxuewow,t3_3w7vr5,t5_2qh13
Bill would say he isn't the Mona Lisa Vito of OPI calls but...,,13,t1_cxj90ev,cxja4s8,t3_3v0e2n,t5_2rx57
So you believe this shit?,,0,t1_cyeic0b,cyf5cs9,t3_3yl41i,t5_2qh33
It was a fucking casino. The economy and Atlantic City went into the tank.,,0,t1_cxn3zn7,cxnaxn5,t3_3vfd04,t5_2x23b
If he has a linkedin page then maybe he has military associations on it that have to be verified? dunno.,,1,t3_3v9irc,cxm28of,t3_3v9irc,t5_2rg06
This sent Howie Mandel to the ER.,,2,t3_3vrskr,cxqirn4,t3_3vrskr,t5_2qt55
Poor people from rich countries get robbed to pay rich people from poor countries.,,2,t3_3wugly,cxzz4qo,t3_3wugly,t5_2s7tt
"No, he's talking about a 90% tax rate, and that's pretty much confiscation. You should really read what he has in store for everyone.",,2,t1_cxvdo85,cxvew3l,t3_3wa76y,t5_2vhdb
"Playing cards with a guy named ""Doc"".",t1_cqzaj8r,1,t3_34vslh,cqzaj8r,t3_34vslh,t5_2qh1i
A guy said he dared a guy to swim across the Missisippii with him because he was so drunk he would drown. He did.,t1_cr1cb33,1,t3_353y5j,cr1cb33,t3_353y5j,t5_2qh1i
"It reminded me of Shabazz's fashion photography book:

https://www.google.com/search?q=a+time+before+crack+shabazz&amp;espv=2&amp;biw=1366&amp;bih=667&amp;tbm=isch&amp;tbo=u&amp;source=univ&amp;sa=X&amp;ei=SQNEVcjxJ8KNyASHuIGYAg&amp;ved=0CB0QsAQ

",t1_cqvie67,2,t1_cqv60f9,cqvie67,t3_34itlx,t5_2tycb
That show was terrible.,,-138,t3_3rrpo5,cwqvx53,t3_3rrpo5,t5_2s9h3
If you take away the illegals and ghettoes then we would be much more comparable to Europe.,,-4,t1_cx3r2s5,cx3tdtf,t3_3t68a0,t5_2tk95
You do realize that those little shits are your future overseers.,,0,t3_3s4y41,cwufene,t3_3s4y41,t5_2qh1e
Peripherally in IT but I have a moderate paying job 5 miles from my house with a literally 10 minute commute. Also can go home and take a break during the day at any time if I have to. Any job 5 miles further where I live means an hour to an hour and a half commute. So I am pretty much working up to 15 hours a week less for a little less pay.,,2,t3_3tapv8,cx4klv4,t3_3tapv8,t5_2qnp7
They should keep walking back to Fuckistan.,,-2,t3_3q93yt,cwdqqte,t3_3q93yt,t5_2qh8e
Umm good riddance .,t1_concv3d,1,t3_2w23zz,concv3d,t3_2w23zz,t5_2to41
"""Thee Ohio State University""",t1_cfbyk2v,1,t3_1xhjh1,cfbyk2v,t3_1xhjh1,t5_2s7tt
"Oh yeah the ""million dollar"" shithouse with the 1% 50 year mortgage. Canada eh? ",,-4,t1_cwf6twc,cwf6van,t3_3qeia7,t5_3328c
What a dumbass.,,2,t3_3o6rkv,cvv9fxg,t3_3o6rkv,t5_2qh4r
Moochelle says it is too many calories for school children.,t1_cqsmtwf,-11,t3_349g2d,cqsmtwf,t3_349g2d,t5_2u1if
Not to creep you out but the military collects all the DNA from the battlefield when possible.,,0,t1_cwuowhr,cwuu2ir,t3_3s58fj,t5_2qm21
Shut up Whitey!,,-1,t3_3u1fzo,cxbh5nz,t3_3u1fzo,t5_2s7tt
perv,t1_cgqavsa,-29,t3_22sszr,cgqavsa,t3_22sszr,t5_2qh0u
"I was going on a ferry to Martha's Vineyard at the height of tourist season. I have to go to this client that's 120 miles from my house and is/was a total bitch. Some tall tourist guy demands to know the ferry schedule from me. I said I don't know the ferry shedule. He snorted, ""Thanks for the help not!""",t1_cf71aa2,3,t3_1wzn89,cf71aa2,t3_1wzn89,t5_2qh1i
He should cut his dick off then. Or someone else will.,,-3,t3_3rho7w,cwoihgy,t3_3rho7w,t5_2qh11
"Not a bunch of lies. I mean real proof. ""Climate change in 60 seconds"" LOL.
http://www.telegraph.co.uk/comment/columnists/christopherbooker/6679082/Climate-change-this-is-the-worst-scientific-scandal-of-our-generation.html",,-14,t1_cwqsgmf,cwqsn7z,t3_3rr1sx,t5_2qh1n
It was on channel 5.,,1,t1_cxbeomv,cxbfazo,t3_3u14w0,t5_2rx57
I dunno what about Attila the Hun. I'm talking about now baby!,,-6,t1_cy03u8s,cy0466h,t3_3wtity,t5_2qhu2
"My mom has treated me and her grandkids fairly shittily. At 83 she refused to cosign for my kid's student loan because she was afraid we wouldn't pay it. She sent an email asking if my kid was going to community college. NO SHE FUCKING GRADUATED FROM A SEVEN SISTERS COLLEGE BITCH.

Now she's dying and my multi millionaire brother who hasn't given or offered to even loan me one red cent (""your financial situation is none of my concern"") texts me this.

Sorry I have no money to fly across the country. Sucks to be her huh?",,0,t3_3vt06y,cxrllfb,t3_3vt06y,t5_2s7tt
So how many of those refugees they be takin'?,,1,t3_3t611q,cx4k4w7,t3_3t611q,t5_2qqjc
When you let in millions of terrorists on welfare you go broke and they kill you. See Tsarnaev brothers for what will happen.,,-1,t3_3tvb4j,cxagoie,t3_3tvb4j,t5_2s7tt
Nowhere near a billion. Jebus.,t1_coz3mxk,1,t1_cnxf8ei,coz3mxk,t3_2tarbs,t5_2qh3l
Newbury st. not Newberry st.,,3,t1_cyko24l,cykq1ai,t3_3za800,t5_2qi6d
Is it a bomb?,,2,t3_3psbja,cw95sae,t3_3psbja,t5_2qhsa
"Illegal immigrant criminals and terrorists, Iran nukes, outrageous taxes, shittier and more expensive health insurance , more welfare,more prejudice against whites...need I go on?",t1_coyxh82,1,t3_2xayhv,coyxh82,t3_2xayhv,t5_2qh1i
"I say all the white students transfer out, and the blacks can pay their own tuition with no whitey money.",,1,t3_3t2gwt,cx3n71r,t3_3t2gwt,t5_2qh33
Duh you know that you and I own GM don't you? That's why it's called government motors.,t1_cpbck6t,1,t1_cpbcbsb,cpbck6t,t3_2yn165,t5_2qqjc
Where's the steamer trunk?,t1_cf62idz,1,t3_1wvnfl,cf62idz,t3_1wvnfl,t5_2qh03
Not something I hadn't thought of many times.,t1_cgj99h0,2,t3_223wiq,cgj99h0,t3_223wiq,t5_2qqjc
Whatever you say Moochelle.,t1_ckaf1kc,0,t3_2fks7y,ckaf1kc,t3_2fks7y,t5_2s5oq
Letting my wife pile up credit card debt rather than confronting her and nnot refinancing it.,t1_cfkeoya,1,t3_1yei3p,cfkeoya,t3_1yei3p,t5_2qh1i
Running headlong into a wall involuntarily.,t1_cftg3m1,1,t3_1zfu4r,cftg3m1,t3_1zfu4r,t5_2qh1i
A young woman at work started telling me about her uterus. I was married with a kid. Another woman asked her how her boyfriend was. I was the boyfriend . I was so naieve I didn't think women would hit on married men.,t1_coyxdii,0,t3_2x9j0u,coyxdii,t3_2x9j0u,t5_2qh1i
Umm he was a dictator?,t1_coz3hzr,0,t1_cobcl2c,coz3hzr,t3_2urs76,t5_2ti4h
What about Hillary pocketing tens of millions from foreign governments? Shouldn't she go to jail?,t1_cs2108r,-11,t1_cs1uu99,cs2108r,t3_39ae7k,t5_2cneq
"Spending a $50,000 (in 60's money) home improvement loan on vodka leaving me and my brother with fiberglas walls and ceilings and plywood floors. Also yelling at each other every night and throwing furniture until 3 in the morning.",,2,t3_3ppn0w,cw8srmb,t3_3ppn0w,t5_2qh1i
"He's the king you know. He's our fearless leader, and can do anything he wants.",t1_cfhlvpd,-15,t3_1y5eux,cfhlvpd,t3_1y5eux,t5_2qh6e
"I agree. Even if McDonald's hires you you probably could not keep up the pace physically. I worked at a minimum wage job in prep school washing dishes, mopping floors, cleaning bathrooms. I was in great shape (on the football team and 16 years old) and was thoroughly exhausted going home at night.",t1_cissasj,3,t1_cisq2r0,cissasj,t3_2a8jwo,t5_2qstm
He's also a racist apparently.,,-7,t1_cy2bbek,cy2bgwe,t3_3x7bic,t5_2qh2p
The funny thing is a lot of their money goes to screening and not research.,,-3,t3_3vgalr,cxncawj,t3_3vgalr,t5_2qqjc
"Have fun hearing ""President Trump"" for 8 years.",,27,t3_3vwpkc,cxrjdcz,t3_3vwpkc,t5_2t5y3
Like to see what would happen if Obama's kids were portrayed as monkeys. The whole liberal world would literally lose its collective mind.,,2,t3_3xzxeu,cy9jzyw,t3_3xzxeu,t5_2s7tt
No more free speech in England huh? Banning people won't stop it. We threw you guys out 200 years ago.,,8,t3_3xcf58,cy3pq3k,t3_3xcf58,t5_2u7i2
"Oh, it's proven alright.

https://en.wikipedia.org/wiki/Lyudmila_Pavlichenko",,1,t1_cv9zflt,cvab2y0,t3_3lfxef,t5_2r2jt
His dad wanted to social justice warrior the muslim cause.,,53,t3_3lx3vb,cvac0qq,t3_3lx3vb,t5_2s7yq
Pretty much. Kinda strange considering Asian drivers' reputations.,,1,t1_cvtzdm1,cvux0by,t3_3o33bg,t5_2qh0u
"""There's a bad moon on the rise"" or ""There's a bathroom on the right"".",t1_cmyxtzn,1,t3_2pogxr,cmyxtzn,t3_2pogxr,t5_2qh1i
I thought cold sank instead of rising like heat. Dunno how this would work.,t1_cnadlso,3,t3_2qwerm,cnadlso,t3_2qwerm,t5_2ti4h
They don't show Kolyma.,t1_cprqwu8,1,t3_30d8ue,cprqwu8,t3_30d8ue,t5_2si92
Dunno. read it in a book.,t1_ch7cjcp,0,t1_cgw7f12,ch7cjcp,t3_23dkkc,t5_2s7tt
Kill all my enemies.,t1_ck4wvwe,1,t3_2f0qrl,ck4wvwe,t3_2f0qrl,t5_2qh1i
"It could have been called ""Vespucciland"".",t1_cmt1r15,4,t3_2p2lfh,cmt1r15,t3_2p2lfh,t5_2szyo
I would read Nature or Science for that not some biased anti global warming skeptic rag.,t1_ct33mgh,-23,t1_ct33g6v,ct33mgh,t3_3d8zay,t5_2qh3l
